recipename,instructions,cuisine,course_type,dietary_preference
Creamy Strawberry Yogurt Pops,"[""Popsicle molds, small cups & Popsicle sticks"", ""In a medium sized pot, bring water to a boil. Stir in the flavored gelatin. Stir until dissolved, then add sugar. Keep stirring until all the gelatin and sugar is dissolved. This may take about 3-5 minutes."", ""Add yogurt a cup at a time and using a wire whisk, mix until smooth adding the additional 2 cups of plain yogurt. Pour into Popsicle mold or cups and freeze for a minimum of 6 hours or overnight."", ""I did both molds and cups. I put all the little cups in a 9x13 inch glass plan so it was easier to place in the freezer. You can add foil over the whole dish then poke holes to add the sticks into the cups. Or I just placed the sticks in each cup and placed them in the freezer, then went back after about 30 minutes and made sure the sticks where not tilted over. Then freeze 6 hours or overnight.""]",american,dessert,vegetarian
Ginger Orange Swirl Cake,"[""Preheat oven to 325\u00b0."", ""Coat an 11 x 7-inch baking dish with cooking spray; dust with 1 tablespoon flour."", ""Place granulated sugar, butter, and orange rind in a large bowl; beat with a mixer at medium speed until well blended. Add orange juice concentrate and eggs, 1 at a time, beating well after each addition."", ""Weigh or lightly spoon 9 ounces flour (about 2 cups) into dry measuring cups; level with a knife. Combine 9 ounces flour and next 4 ingredients (through salt), stirring with a whisk. Beating with a mixer at low speed, add flour mixture to butter mixture alternately with sour cream, beginning and ending with flour mixture. Beat just until blended."", ""Combine 3 tablespoons batter, brown sugar, crystallized ginger, and orange marmalade in a small bowl."", ""Spoon remaining batter into prepared dish. Dollop marmalade mixture over batter; swirl batters together using the tip of a knife."", ""Bake at 325\u00b0 for 38 minutes or until lightly browned. Cool completely on a wire rack.""]",american,dessert,omnivorous
Coconut Chocolate Dream Pie,"[""In heavy pan over medium-high heat, toast coconut until lightly browned. Remove 1 tablespoon of the coconut for garnish. Add rice milk and orange juice concentrate. Bring the mixture to a simmer, then stir in chocolate chips. Remove from heat, and continue stirring until the chips are melted and the mixture is smooth."", ""Pour maple syrup, vanilla extract, almond extract and tofu into an electric blender or food processor; blend until the mixture is creamy. Add chocolate mixture to the blender, and blend until the mixture is combined. Pour the filling into the pie crust. Cover, and chill for 2 or more hours. Garnish with the reserved coconut before serving.""]",american,dessert,vegan
Honey-Orange Crumb Cookies,"[""With a sharp paring knife or vegetable peeler, shave off the peel of the oranges in long strips."", ""Scrape away the bitter white pith from the inside of the peel, then dice the strips of zest into small pieces, about 1/4 inch square."", ""You should have about a cup of diced peel."", ""(Enjoy the rest of the orange as a fruit.)"", ""Pour the honey into the saucepan, set the pan over medium heat, and stir in the cut orange peel."", ""Slowly bring the honey to a simmer, and cook, stirring frequently, until the squares of peel are slightly translucent, about 3 minutes."", ""Stir the bread crumbs and 1 cup of the chopped walnuts into the honey, and return to a simmer."", ""Stirring frequently, simmer the mixture gently for 6 minutes or so, until the bread crumbs have absorbed most of the honey, forming a dough that pulls away from the sides of the pan."", ""Take the pan off the heat."", ""With a brush or your fingers, spread a thin film of vegetable oil on your clean countertop or other hard work surface."", ""Scrape the dough out of the pan onto the oiled surface and, with the lightly oiled blade of the metal spatula, spread it into a rough round or oblong layer, about 1/2 inch thick."", ""Pour the remaining cup of chopped walnuts onto a plate or tray."", ""Rub a bit of vegetable oil on your fingers and hands (so the dough wont stick), break off a bunch of teaspoon-sized pieces of warm dougha dozen or soand rapidly roll them into bite-sized balls, the size of grapes."", ""While still warm, roll the balls in the nuts, so the whole surface gets a light nut coating, and place them on the parchment-lined tray."", ""Working quickly, shape another batch of balls, and coat them with nuts."", ""When cool, store panmelati in a cookie tin or other airtight container, lined with wax paper."", ""They will keep for about a week.""]",american,dessert,vegetarian
Crown Jewel Dessert,"[""Dissolve cherry, lemon and orange gelatin separately, using 1 cup of the boiling water for each flavor."", ""Add 1/2 cup cold water to each flavor."", ""Pour each flavor into separate pans."", ""Chill."", ""Cut into 1/2-inch cubes."", ""Dissolve orange-pineapple flavor gelatin and sugar in remaining cup of boiling water."", ""Add pineapple juice. Blend Cool Whip into orange-pineapple gelatin. Fold in gelatin cubes."", ""Pour into 9-inch tube pan or 8-cup mold."", ""Chill overnight or until firm.""]",american,dessert,omnivorous
"Pasta Shells with Mushrooms, Asparagus, and Boursin Sauce","[""In a large frying pan, melt the butter with the oil over moderate heat."", ""Add the mushrooms and salt and cook, stirring occasionally, until the mushrooms are tender and well browned, about 8 minutes."", ""Add the chicken broth and Boursin cheese and bring to a simmer while stirring."", ""Snap the tough ends off the asparagus and discard them."", ""Cut the spears into 1/2 inch pieces."", ""In a large pot of boiling, salted water, cook the pasta until almost done, about 6 minutes."", ""Add the asparagus and cook until it and the pasta are just done, about 4 minutes longer."", ""Drain."", ""Toss with the mushrooms and sauce.""]",italian,main,vegetarian
Sausages with Grapes,"[""Preheat grill or start barbecue."", ""Grill sausages over medium-high heat until cooked through."", ""In a skillet, heat olive oil."", ""Add grapes and toss over medium heat until plumped and heated through, about 2 minutes."", ""(Alternatively, pan-fry sausages in a little olive oil; remove after 15 minutes or when cooked, add grapes to pan and follow instructions above.)""]",italian,main,omnivorous
"Tuscan Kale With Almonds, Plums, And Goat Cheese","[""Whisk together the first 5 ingredients (through olive oil) in a large serving bowl. Add remaining ingredients to dressing, and toss well to combine. Divide salad among 4 salad plates, and serve immediately.""]",tuscan,side,vegetarian
Chicken Pasta Heaven,"[""Preheat the oven to 400F"", ""Place the eggplant, leeks and red onions into a large roasting tray and drizzle over two tablespoons of the olive oil."", ""Mix well to coat, then roast in the oven for 15 minutes, or until starting to soften."", ""Add the peppers, tomatoes and herbs to the roasting tin, mix well and season with salt and freshly ground black pepper."", ""Add another tablespoon of olive oil if the mixture looks a little dry."", ""Return the tray to the oven for a further 15 minutes, or until the vegetables are tender and starting to caramelise around the edges."", ""Meanwhile, bring a large pan of water to the boil."", ""Add the pasta and cook for 10-12 minutes, or until the pasta is al dente."", ""Drain the pasta and return to the pan."", ""Stir in the butter and toss well to coat."", ""In a small bowl, mix together the parsley, the remaining olive oil and the garlic until well combined."", ""Remove the roasted vegetables from the oven and tip them into the pan with the pasta, then add the cooked chicken strips."", ""Drizzle over the parsley, olive oil and garlic sauce and mix well."", ""Stir in the mascarpone cheese until the pasta is coated and the sauce is creamy and smooth."", ""Pile into pasta bowls and serve immediately.""]",italian,main,omnivorous
Cheez-It Fried Chicken,"[""Clean, wash, and dry chicken."", ""In shallow pan, combine Cheez-It(R) Cracker crumbs with salt, oregano, and celery salt."", ""Roll pieces of chicken in crumbs until well coated."", ""Dip chicken in mixture of egg and milk."", ""Roll again in remaining crumbs until well coated."", ""In a large fry pan, brown chicken a few pieces at a time, in shortening."", ""When all pieces are browned, arrange back in fry pan."", ""Cover and cook over low heat until tender, about 30 minutes.""]",american,main,omnivorous
Brown Rice,"[""Melt margarine in baking dish, add other ingredients."", ""Cover with tinfoil."", ""Bake at 350\u00b0 for 1 hour.""]",american,side,omnivorous
Easy Slow-Cooker Beef Stew,"[""Mix first 4 ingredients in slow cooker."", ""Add all remaining ingredients except flour and water; toss to coat."", ""Cover with lid."", ""Cook on LOW 8 to 9 hours (or on HIGH 4 to 5 hours)."", ""Transfer meat and vegetables to serving bowl with slotted spoon; cover to keep warm."", ""Mix flour and water until well blended."", ""Whisk into juices in slow cooker; cover."", ""Cook on HIGH 15 min."", ""or until sauce is slightly thickened."", ""Spoon over meat and vegetables.""]",american,main,omnivorous
Texas Pizza,"[""Combine flour, cornmeal and 1/2 teaspoon salt in mixing bowl. Cut in shortening thoroughly."", ""Sprinkle in water, 1 tablespoon at a time, mixing with fork until all flour is moist."", ""Form dough into ball and press out on a pizza pan; chill for 1 hour.""]",tex-mex,main,omnivorous
Peach Jelly,"[""*Boil peelings and pits left from making Peach Jam in 5 cups of water for 10 minutes to make 4 cups juice.""]",american,dessert,vegan
Chocolate Malt Drops,"[""Combine first 5 ingredients in bowl."", ""Mix well."", ""Add eggs, well mixed."", ""Drop by rounded teaspoonfuls onto greased cookie sheet."", ""Bake at 375\u00b0 for 8 minutes or until golden brown."", ""Cool on wire rack.""]",american,dessert,vegetarian
Bistro Chicken,"[""Preheat oven to 375F."", ""Mix dressing and seasonings."", ""Coat chicken with dressing mixture."", ""Place in shallow foil-lined baking pan."", ""Bake 18 to 20 min."", ""or until chicken is cooked through (170F).""]",american,main,omnivorous
Zucker Hutchen,"[""Cream butter and white sugar until fluffy. Stir in egg yolk and milk. Add citron to butter mixture and stir in. Add flour and baking powder; blend well. Chill until firm, about 1 hour."", ""Preheat oven to 350 degrees F (175 degrees C). In a clean, dry, glass or metal bowl, whip egg white until frothy. Gradually incorporate 1 1/2 cups confectioner's sugar; beat until meringue holds its shape. Fold in almonds."", ""Roll dough 1/8 inch thick on lightly floured board; cut out small rounds with 2 inch cookie cutter. Place 1 inch apart on a greased baking sheet. Put 1 teaspoon Almond Meringue in center of each round to make it look like the crown of a hat."", ""Bake 10 to 12 minutes in the preheated oven, or until golden. To Make Icing: Gradually add water to 2 cups confectioner's sugar, mixing until icing is stiff. Add 1 to 2 drops of food coloring. When cookies are cool, pipe around crown of hat with Icing to look like a hatband.""]",german,dessert,omnivorous
Smokies,"[""Combine wieners, jelly and sauce."", ""Cook in crock-pot approximately 1 hour.""]",american,side,omnivorous
Molten Spiced Chocolate Cabernet Lava Cakes,"[""Preheat oven to 425 degrees."", ""Butter 4 (6 oz) custard cups/souffle dishes."", ""Place on baking sheet."", ""Microwave chocolate & butter until butter is melted."", ""Whisk until chocolate is completely melted and blended inches"", ""Stir in wine, vanilla & sugar untiled well blended."", ""Whisk in eggs & egg yolk."", ""Stir in cinnamon and ginger."", ""Divide into dishes."", ""bake for 15 to 20 minutes (I've noticed some ovens take the full 20 minutes so watch carefully after 15 minutes) or until sides are firm but centers are soft."", ""Remove and let stand for one minute."", ""Loosen edges with knife and invert onto plates."", ""sprinkle with confectioners sugar and decorate each serving with raspberries.""]",french,dessert,omnivorous
Creamy Skillet Chicken,"[""Heat olive oil in 12-inch nonstick skillet, over medium-high heat and brown chicken, turning once. Remove chicken; keep warm."", ""Bring Lipton(R) Recipe Secrets(R) Vegetable Soup Mix blended with milk and water to a boil in same skillet. Reduce heat and simmer 4 minutes."", ""Stir in cream cheese until melted and simmer 3 minutes. Add chicken and cook 5 minutes or until chicken is thoroughly cooked. Serve with warm buttermilk biscuits, hot cooked rice or noodles.""]",italian,main,omnivorous
Crawfish Etouffee,"[""Melt butter in skillet; saute onions, bell pepper and celery until tender."", ""Add any crawfish fat and let cook 15 to 20 minutes on low."", ""Add crawfish tails and cook another 15 minutes."", ""Season well."", ""Serve over rice.""]",cajun,main,omnivorous
Dijon Chicken,"[""Cook noodles."", ""Brown chicken and onions."", ""When brown and tender, remove only chicken from skillet."", ""Put in mustard, parsley, soup and milk."", ""Heat for 5 minutes, then return chicken and heat through.""]",french,main,omnivorous
Easy Black Bean Dip,"[""Blend all ingredients until desired consistency (food processor is best). Serve hot or cold with New York Style brand Premium Deli Snacks.""]",mexican,starter,vegan
Watergate Pistachio Cake,"[""Mix well and bake at 350\u00b0 for 30 to 35 minutes in greased 9 x 13-inch pan or layer.""]",american,dessert,omnivorous
Sausage And Bean Slow Cooker Dinner,"[""Heat oil in a large skillet over medium heat. Cook the sausage until well browned, 5 to 7 minutes."", ""Stir in the onion; cook and stir until lightly browned, 5 to 7 minutes more."", ""Remove the sausages, and cut them into 1 1/2-inch to 2-inch pieces."", ""Pour the beef stock, tomatoes, tomato puree, and hot sauce into the skillet with the onion and bring the mixture to a simmer, scraping up any brown bits from the bottom."", ""Place the carrots into a slow cooker, followed by the garbanzo beans and kidney beans."", ""Arrange the sausage pieces on top."", ""Pour the sauce from the skillet into the slow cooker."", ""Cook on Low for 4 to 6 hours.""]",american,main,omnivorous
No Fat Oatmeal Apple Raisin Muffins,"[""Beat egg; stir in remaining ingredients, mixing just until moistened."", ""Pour into 12 greased muffin cups until 3/4 full."", ""Bake at 400\u00b0 for 15 to 20 minutes."", ""Serve cool or piping hot with butter.""]",american,dessert,omnivorous
Beef And Rice,"[""Cook ground beef and onions until brown."", ""Cook rice and drain. Mix these 2 ingredients and add all other ingredients."", ""Let simmer 10 minutes."", ""Top with cream cheese."", ""Cool and serve.""]",american,main,omnivorous
Eggplant Spread,"[""Pierce the eggplants in several places with a fork and grill them on a rack set about 4 inches over glowing coals for 30 to 35 minutes, or until they are very soft."", ""(Alternatively, the eggplants may be broiled on the rack of a broiler pan under a preheated broiler about 6 inches from the heat, turning them, for 30 to 35 minutes, or until they are soft.)"", ""Let the eggplants cool until they can be handled, halve them, and discard as many seeds as possible."", ""Scrape the flesh away from the skin and squeeze the eggplant gently between paper towels to remove as much excess liquid as possible."", ""In a bowl mash the eggplant coarse, stir in the onion, the garlic, the minced herbs, the oil, the vinegar, the capers, and salt and pepper to taste, and let the spread stand, covered and chilled, for 3 hours to allow the flavors to develop."", ""The eggplant spread may be made 1 day in advance and kept covered and chilled."", ""Garnish the eggplant spread with the parsley sprigs and serve it with the pita wedges.""]",mediterranean,side,vegan
Houston Restaurant'S Baked Potato Soup,"[""Bake potatoes until done; peel and chop into large chunks. Melt butter in large pan."", ""Over low heat, slowly stir in cheese and sour cream until melted and well combined."", ""Add potatoes, green onions, salt and pepper."", ""Simmer for approximately 10 minutes."", ""Remove from heat and refrigerate overnight."", ""On day of serving, heat soup until hot."", ""Pour into soup mugs and sprinkle bacon bits or crisply fried bacon (crumbled) on top.""]",american,starter,omnivorous
Pumpkin Pie Flans Recipe,"[""Preheat the oven to 350 degrees F. Arrange 8 (6-ounce) ramekins in a 9-inch by 13-inch baking pan and place in the oven to heat."", ""Cook 1 cup of the sugar, 1/4 cup water, and the cream of tartar in a large frying pan over medium-high heat, stirring occasionally, until the sugar turns deep golden and a caramel forms, 8 to 12 minutes."", ""Remove the ramekins from the oven and pour about 1 tablespoon of the caramel inside each dish."", ""Tilt the dishes until the caramel thickens and evenly coats the bottoms and 1 to 2 inches of the sides."", ""Bring a kettle of water to the boil."", ""In a bowl, whisk the remaining 2/3 cup of sugar with the remaining ingredients (except the whipped cream and graham crackers)."", ""Pour the mixture into the ramekins."", ""Set the baking pan onto an oven rack."", ""Pour enough boiling water into the pan to come halfway up the sides of the ramekins."", ""Bake until the center of the flans barely jiggles and a knife inserted in the center comes out clean, about 25 minutes."", ""Remove the ramekins from the water and cool on a rack, then chill, covered, at least 4 hours."", ""5."", ""Run a thin metal spatula around the inside of each ramekin, then invert onto a deep plate."", ""Set the the ramekins in hot water for a few minutes to loosen the remaining caramel (not all of it will come off); scrape the caramel over the flans."", ""Serve with a little fresh whipped cream and crumbled graham crackers.""]",american,dessert,vegetarian
Salmon with Creamy Tomato Dill Sauce,"[""In casserole dish, combine butter, shallots and garlic."", ""Microwave, covered, on High for 2 minutes to soften."", ""Add tomato."", ""Microwave, covered, on High for 2 to 3 minutes or until tomato is sauce-like."", ""In a small bowl, blend cornstarch with 1 tsp (5 mL) cold water."", ""Stir into casserole dish along with cream and dill."", ""Set aside."", ""Arrange salmon in baking dish."", ""Pour wine over top."", ""Cover with plastic wrap and turn back one corner to vent."", ""Microwave on Medium (50%) for 4 to 7 minutes or until fish is opaque."", ""Drain liquid from dish into tomato mixture."", ""Season with salt and pepper to taste."", ""Keep salmon covered while finishing sauce."", ""Microwave sauce, uncovered, on High for 2 to 3 minutes, stirring once, until it comes to a boil and thickens slightly."", ""Place salmon fillets on serving plates and spoon sauce over top.""]",european,main,omnivorous
Saskatoon Berry Pie,"[""Preheat oven to 375 F"", ""Wash and clean the berries"", ""Place then in a large mixing bowl and toss with sugar/spice cornstarch."", ""Bake at 375 for 40 minutes or until top crust is flaky brown"", ""Pile high in pie shell and sprinkle with remaking sugar mix.""]",canadian,dessert,omnivorous
Double Baked Potatoes,"[""Wash and slice potatoes in half in the direction that will best offer a tipless boat."", ""Wrap in foil and bake for one hour or 1 hour 15 minutes in a 350F oven - you will know they are ready when you squeeze them and they give - if they don't give - they aren't quite ready yet."", ""Remove from oven and cool."", ""Scoop all your potato flesh into a large bowl - pick the 6 best boats and Discard the remaining."", ""Add cream cheese - pepper salt and butter and mash until nicely blended and smooth."", ""Scoop the mash potato back into the boats - heap them up."", ""Sprinkle bacon bits and chives / onion greens on top."", ""Put back in a 350F oven for approximately 30 minutes - you just want them warmed up again but don't want to cause a crust."", ""and EAT !"", ""Buon Apetite !"", ""These potatoes are pictured with a nice top sirlon beef steak marinated in my \""Red Wine Beef Marinade\"" - have a peek - they go really well together.""]",american,side,vegetarian
Crunchy Cinnamon Bundt Cake,"[""Preheat the oven to 350 degrees. Coat a 10-cup bundt pan with canola cooking spray. Use a silicone brush to get in all the groves. Dust lightly with turbinado sugar getting in all the groves, middle and up the sides. Turn the pan as you sprinkle. Set the pan aside on a 1/2 sheet pan."", ""In a medium mixing bowl whisk together the flour, baking powder, cinnamon and salt. Set aside."", ""With an electric mixer on medium high speed, cream the butter, shortening, sugar and vanilla extract until light and fluffy; about 3 minutes."", ""Add the eggs, one at a time and beat just until blended."", ""On low speed, add the flour mixture and half and half in 5 increments, starting and ending with the flour. Beat at medium speed between additions to blend. Scrape the batter evenly into the bundt pan and even the top. Tap lightly on the counter to settle the batter. Bake for about 45 minutes or until golden brown and a cake tester comes out clean. Cool in the pan 15 minutes and then \r\nturn out on a rack to cool completely before storage."", ""COOKS NOTES: After baking many bundt pans in decorative pans here are some easy hints:\r\n1. Use Pam canola cooking spray and then spread with a silicone brush.\r\n2. For an easy cake release from the pan; cool no more than 15 minutes. Shake the pan gently on the counter to release the cake from the sides of the pan before turning over.""]",american,dessert,vegetarian
Super Hot Chili,"[""In a dutch oven brown ground beef, onion, chili powder, olive oil, and garlic clove; drain off grease."", ""Combine remaining ingredients with ground beef mixture."", ""Simmer 1 hour, stirring frequently.""]",tex-mex,main,omnivorous
Brown Butter Tomatoes,"[""Core the tomatoes and slice them 1/3-inch thick. Divide the tomato slices among 4 plates, overlapping the slices just a little."", ""Place the butter in a small heavy-bottomed saucepan and set over medium low heat. Let the butter melt completely. It will begin bubbling. Let the butter simmer away, cooking off its water, until it begins to smell nutty and brown. Swirl the pan every 30 seconds or so. When the butter turns the color of a hazelnut, remove it from the heat. Use a soup spoon to ladle it over the tomatoes. They'll sizzle! You want to dress the tomatoes with the butter as if you were pouring ganache over a cake -- be generous!"", ""Season the tomatoes with salt and pepper, then rush the plates to the table so everyone can taste the tomatoes while the butter is hot! Mop up the butter and tomato juices with good bread. Toast to summer!""]",american,side,vegetarian
Dump Cake,"[""Pour pie filling in a glass 9 x 13-inch baking dish."", ""Add crushed pineapple."", ""Sprinkle dry cake mix over top of fruit."", ""Pour liquid Butter Buds on top."", ""(Try to pour liquid evenly over cake mix so all of cake mix is moistened.)"", ""Bake at 350\u00b0 until golden brown (approximately 40 minutes)."", ""Top with Cool Whip and serve warm.""]",american,dessert,vegetarian
Lentil Soup,"[""Simmer ingredients for an hour or so, then add cooked potatoes and carrots, about 2 cups diced potatoes and 1 cup diced carrots. Add water to soup to taste."", ""Cook for about another 30 minutes or so.""]",middle eastern,main,vegan
Chicken Elegante,"[""Saute in butter the celery and onion."", ""Set aside."", ""Cut, bone and cut into pieces the chicken breasts. Mix with sour cream, mushroom soup, mushrooms, lemon pepper and pepper."", ""Spread in 13 x 9 x 2-inch casserole dish.""]",american,main,omnivorous
Broccoli Salad Raw Recipe,"[""Pour dressing over salad ingredients and chill."", ""Makes large bowl."", ""Some chick peas or possibly green beans may be added to broccoli for a different taste.""]",american,side,vegan
No-Bake Cherry Balls,"[""Dry the cherries on paper towel."", ""Cream the butter and gradually mix in the icing sugar and orange juice."", ""Add coconut and mix well."", ""Note: this mixture will be soft."", ""Roll a small portion of the coconut mixture evenly around each cherry and then roll in graham wafer crumbs."", ""Place on wax paper and keep cool.""]",american,dessert,vegetarian
Diabetic Spice Cookies,"[""Boil water, shortening, raisins and spices together for 3 minutes."", ""Let cool; beat in eggs."", ""Dissolve salt, soda and saccharin tablets in water and add to eggs."", ""Sift flour and baking powder and add and mix well."", ""Drop by teaspoonfuls on ungreased cookie sheet."", ""Bake at 350\u00b0 for 12 to 15 minutes.""]",american,dessert,omnivorous
Turkey Pot Pie Soup,"[""In a large soup pot add the butter and the onions and cook for 3-4 minutes. Then add the flour and cook for another minute."", ""Slowly add in the chicken broth and the milk while whisking so there are no lumps."", ""Then add in the remaining ingredients. Cover with a lid and cook on simmer for 10-15 minutes or until the potatoes are fork tender. Then serve.""]",american,main,omnivorous
