recipename,instructions,cuisine,course_type,dietary_preference
Papa'S Rellenos-Stuffed Potatoes,"[""Cut baked potatoes in half lengthwise, and scoop out pulp, leaving shells intact; set shells aside. Mash pulp; stir in butter and milk, and set aside."", ""Stir Parmesan cheese and next 4 ingredients into Bechamel Sauce; spoon evenly into shells. Top with mashed potatoes, and place on a baking sheet. Sprinkle with Cheddar cheese."", ""Bake at 325\u00b0 for 15 to 20 minutes or until thoroughly heated.""]",latin american,side,omnivorous
Pan Roasted Cornish Hen with Blue Corn Chorizo Dressing with Cranberry Mango Relish,"[""Preheat the oven to 350 degrees F. In a medium saute pan over medium heat, melt the butter and cook the chorizo, garlic, celery, onion, carrot and poblano for 3 minutes or until lightly browned."", ""Transfer to a mixing bowl and add the cornbread, thyme, sage, cilantro, egg and stock and mix well."", ""Place in 12 by 15-inch baking pan and bake for 25 minutes."", ""In a hot skillet combine cranberries and brown sugar, cook until berries start to pop."", ""Add all other ingredients, except cilantro, and heat, (add a spoon of water if sauce appears dry)."", ""Just before serving, toss in the cilantro.""]",american,main,omnivorous
Lobster Boudan with a Fresh Lemon and Tarragon Butter Sauce,"[""In a food processor, combine the lobster meat, shallots, cream and cognac."", ""Season with salt, cayenne and pepper."", ""Turn the mixture into a mixing bowl."", ""Stir in the rice and parsley."", ""Season with salt, cayenne and black pepper."", ""**To test the seasoning of the sausage, pan-fry a small piece of the filling for a couple of minutes on each side."", ""Re-adjust the seasoning if needed."", ""Either using a feeding tube or a funnel, stuff the sausage into the casings and make 3-inch links."", ""Bring a large saucepan of salted water up to a boil."", ""Poach the sausage for about 5 minutes, or until the sausage is firm to the touch and plump."", ""Remove from the water and allow to cool."", ""In a large saute pan, over medium heat, melt the butter."", ""Pan-fry the sausage for 3 to 4 minutes on each side."", ""Remove from the pan and keep warm."", ""To serve, spoon the sauce in the center of each plate."", ""Lay a crouton in the center of the sauce."", ""Place a couple of links of sausage over each crouton."", ""Garnish with parsley and butter sauce."", ""In a saucepan, over medium heat, combine the shallots and lemon juice."", ""Season with salt and cayenne."", ""Bring the mixture to a boil."", ""Reduce the heat to medium low and simmer until the mixture reduces by half."", ""Add the cream and continue to cook for 2 minutes."", ""Remove from the heat and whisk in the butter, a couple of pieces at a time."", ""Season with the salt and cayenne."", ""Strain through a fine-mesh sieve."", ""Add the hot sauce, Worcestershire and chopped tarragon."", ""Keep hot."", ""Yield: about 2 cups""]",french,main,omnivorous
Peach Schnapps Punch Recipe,"[""Separately: Dissolve Jello in 9 c. of boiling water."", ""Dissolve sugar in another 4 c. of boiling water."", ""After both mixtures are dissolved, stir together and add in pineapple juice, lemonade, and peach Schnapps."", ""Pour into 2 ice cream pails; freeze."", ""When ready to serve, thaw 2-3 hrs and add in gingerale to your taste.""]",american,beverage,omnivorous
Curried Mango in Avocado,"[""Slice avocado in half, cutting lengthwise."", ""Carefully pull or twist halves apart, and remove seed."", ""Using sharp paring knife, cut crosshatch pattern into flesh almost to skin, and spoon out cubes, leaving 1/8-inch inside layer of avocado flesh."", ""This keeps avocado shell stable."", ""In mixing bowl, combine avocado cubes, mango cubes, crushed banana chips, curry powder, mayonnaise, lime juice and coriander leaves, stirring together gently."", ""Mound mixture into avocado halves."", ""Sprinkle each with pickled ginger slices.""]",caribbean,side,vegan
Italian Green Olive Salad,"[""INSTRUCTIONS: Rinse the olives under cold running water and drain. Gently crush each one with the side of a small cleaver. The skin and the pulp should tear, but do not break the pit."", ""Finely chop together the celery, celery leaves, anchovies and capers."", ""Place the olives in a mixing bowl; add the chopped aromatics, red pepper flakes and garlic. Add vinegar and enough oil to coat. Mix well."", ""Let stand at room temperature for about 2 hours.""]",italian,main,omnivorous
Aunt Rocky’S Almond Butter Dip/Dressing,"[""Use a 1-cup measuring cup to mix up this dressing. Makes 3/4 cup dip or dressing (serving size 2 tablespoons each)."", ""Put almond butter and hot water in a measuring cup and whisk well until almond butter is thinned. Add remaining ingredients and whisk again."", ""Pour into serving dish for use as a dip. Or drizzle over salad, stir fry dishes, or even ice cream."", ""Tip: The photo shows dipping strawberries in this sauce, which is delicious! It could also be used to dip meats or veggies."", ""Note: To help those who track foods or create recipes using this dip, this recipe has been entered into the food data base on My Fitness Pal under the name \""Aunt Rocky's Almond Butter Dip/Dressing.\"" Serving size is 2 tablespoons."", ""Nutritional information (estimates are per serving based on exact ingredients I used, calculated with a free online recipe analyzer): Calories 106, Total Fat 10 g, Saturated Fat 2 g, Sodium 33 mg, Potassium 2 mg, Total Carbohydrate 3 g, Dietary Fiber 1 g, Net Carbs 2 g, Sugars 1 g, Protein 3 g. Macros: 81% fat, 11% protein, 7% carbs."", "" April 26, 2017 Roxana Lopez for Aunt Rocky's"", ""For more low carb/keto recipes and cooking tips, look for Aunt Rocky's Low Carb Recipes Group on Facebook.""]",american,side,vegan
Squash And Onions,"[""Shred squash and onions in a frying pan."", ""Add pepper and salt. Put oil or bacon grease and cornmeal in pan."", ""Cover and stew until almost done."", ""Remove lid to finish until slightly browned.""]",american,side,vegan
Apple Nachos,"[""Top crackers with apples; place on microwaveable plate."", ""Cover with Singles pieces."", ""Microwave on HIGH 30 sec."", ""or until Singles are melted."", ""Sprinkle with cinnamon sugar.""]",american,snack,omnivorous
No Cholesterol Chocolate Cake,"[""Set oven to 350\u00b0."", ""Blend flour, soda and cocoa in a bowl."", ""Set aside."", ""In a saucepan, melt margarine over low heat and stir in sugar. Remove from heat. Add vinegar and vanilla."", ""Stir in mixture from bowl. Bake in 2 greased layer pans for 20 minutes or until toothpick inserted in middle comes out clean. Allow to cool before frosting. (Use Lite Cocoa Frosting.)""]",american,dessert,vegan
Easy! Kaiser Rolls,"[""Combine the ingredients together in a bowl and mix them."", ""[If you are using a bread machine: put all the dough ingredients into the machine and run it on the dough course."", ""Skip down to step 8.]"", ""Dissolve the yeast in the water, and add it to the bowl."", ""Knead for about 5 minutes until the starts to come together."", ""Add the butter."", ""Knead for another 5 minutes."", ""The butter should be fully incorporated into the dough, and the surface of the dough should be smooth."", ""[First proofing] Gather the dough into a ball, place it in a bowl, and cover it with plastic wrap."", ""Let it rise in a warm place for 40~60 minutes."", ""Check the dough after 40 minutes."", ""It should look like this."", ""[Resting] Divide the dough into 8 pieces and shape them into smooth balls."", ""Let them rest for 10 minutes."", ""While resting, cover them with a slightly damp tea towel, so they don't dry out."", ""Make sure the dough is shaped into a neat ball."", ""use the ball of your hand to slightly flatten the ball into the proper shape for a kaiser roll."", ""Create crown-shaped imprints in the dough using the side of a fork."", ""Press sesame, poppy, or other seeds into the tops of the dough balls, if you want seeded rolls."", ""[Second proofing] arrange the dough on a parchment lined baking sheet, and let the dough rise in a place that is about 38C"", ""When the rolls have risen, spray them lightly damp with water, and bake them in a 200C oven for 15~18 minutes."", ""[Advanced shaping technique] You can also shape the bread using your fingers."", ""This method may not leave clean lines, like you see with the fork above, but I encourage you to challenge yourself and try it.""]",german,side,vegan
Coconut pound cake,"[""Cream butter and sugar together in a large bowl."", ""Add essence."", ""Mix well."", ""Add eggs, one at a time, beating well after each addition."", ""Add flour and salt."", ""Mix well."", ""Fold in the flaked coconut."", ""Mix well."", ""Bake in a greased tube pan at 170 for 1 hour 10 minutes."", ""If you dont have a tube pan, use a loaf pan, and reduce the cooking time by 15 minutes, checking for doneness.""]",american,dessert,omnivorous
Creamed Kale,"[""Blanch the kale in lightly salted water until tender, rinse in ice water, drain and cut into 1/2-inch ribbons."", ""In a large saute pan over medium heat, melt the butter and add the kale, cream and nutmeg."", ""Reduce the heat to low and cook for 5 minutes, or until the cream has reduced and thickened."", ""Season with salt and pepper to taste.""]",american,side,vegetarian
"Hijiki Seaweed, Konnyaku, and Bean Sprout Namul","[""In a pot, combine the bean sprouts with enough water to cover."", ""Add a pinch of salt and heat."", ""Put the konnyaku in a bowl, then prepare a strainer above it."", ""Also prepare the hijiki."", ""Boil the bean sprouts for about a minute."", ""Then pour the hot water from the bean sprouts over the hijiki."", ""Drain the sprouts in the strainer set above the konnyaku."", ""At this point, I remove the bean sprouts roots."", ""It's helps disperse the residual heat and drain the moisture more quickly."", ""Drain the konnyaku and hijiki in the strainer then combine them in a heat-resistant bowl."", ""Add the ingredients and microwave at 700W for 1 minute."", ""Mix in the bean sprouts, add a little pepper and it's finished."", ""I also created this version featuring bean sprouts and mozuku seaweed"", ""You can also mix in imitation crab or chikuwa, which is also delicious.""]",japanese,side,vegan
Mom'S Cream Of Chicken And Potato Soup,"[""Combine the 2 cans of soup in a medium-size pot."", ""Add the can of evaporated milk, the butter, the package of chicken flavoring, the pepper and onion powder."", ""Stir with a spoon until well blended.""]",american,main,omnivorous
Vegetarian Chicken Chili With Crushed Tortilia Chips And Cheese,"[""In large pot place chick peas, kidney beans, tomatoes, ketchup, sugar, Worcestershire sauce, green chili's, water (add more water if needed) and hot sauce. Stir and cook on medium heat. Add olive oil to skillet and add onions, green pepper, carrots and heat over medium flame. Cook 2 minutes then add garlic, cook until vegetables are tender. Be careful not to burn garlic. Add chili powder, cumin,Greek seasoning and paprika to vegetable mixture. Stir and cook about 1-2 minutes being careful not to burn. Add onion mixture to beans, stir bring to boil, lower heat and simmer for 30 minutes. Add chicken and corn, stir and taste (adjust seasonings as needed. Cook 10 more minutes and serve over rice if desired. Garnish with crushed tortilla chips, chopped tomatoes, chopped onions. Use vegan style grated cheese and sour cream if desired.""]",tex-mex,main,vegetarian
Steamed Corned Beef,"[""Heat the oil in a skillet over medium heat. Add onion, green pepper, red pepper flakes and dried thyme; cook and stir until the onion is beginning to brown, about 7 minutes. Reduce the heat to low and stir in the tomato paste and season with salt and pepper. Simmer for 3 minutes then stir in the water. Mix in the corned beef and then let it simmer until most of the liquid has evaporated.""]",irish,main,omnivorous
Peach Cake,"[""Cream margarine."", ""Mix with flour, salt and 2 tablespoons sugar until like meal."", ""Press into baking dish."", ""Put peach halves (fresh or canned) on top of flour mixture and sprinkle with remaining sugar mixed with 1 teaspoon cinnamon."", ""Pour over peaches."", ""Bake 15 minutes at 400\u00b0."", ""Remove from oven and pour 1 cup milk or cream mixed with 2 beaten egg yolks."", ""Bake 30 minutes at 400\u00b0.""]",american,dessert,vegetarian
Chicken & Sweet Corn Soup,"[""Place chicken stock and ginger in a large saucepan. Bring to the boil and reduce to a simmer. Add chicken breasts to saucepan and cook for 6 minutes, or until cooked through. Remove chicken and allow to cool slightly before shredding."", ""Add creamed corn and soy sauce to chicken stock. Heat through and stir in shredded chicken, eggwhites and spring onions. Cook a further minute and serve immediately.""]",chinese,starter,omnivorous
Savoury Mince,"[""Brown Mince and finely chopped onion."", ""Drain Fat from mince."", ""Add half of the water & vegetables."", ""Cook 5 minutes on stove top on medium."", ""Take off heat then."", ""Slowly add the gravy powder and other half water whilst stirring inches."", ""Add the rest of ingredients."", ""Return the heat and simmer for 20 mins"", ""Serve with crusty bread (optional)."", ""Ta da!""]",british,main,omnivorous
Turkey Meatballs,"[""Mix all ingredients together in a medium bowl."", ""Form into meatballs."", ""Place on greased cookie sheet."", ""Bake at 375 for 20 - 25 minutes.""]",italian,main,omnivorous
Peanut Sticks,"[""Trim crusts from bread."", ""Cut into finger strips. Place on baking sheet. Toast strips and trimmings in a 250\u00b0 oven until very dry and light brown."", ""Make crumbs of trimmings."", ""Dilute peanut butter with enough oil in bowl to make thick liquid."", ""Dip sticks into peanut butter mixture to coat."", ""Roll in crumbs."", ""Let stand for 12 to 24 hours or until dried. Will keep indefinitely.""]",american,side,vegetarian
Low Fat Chicken Salad,"[""Mix together chicken, celery, mayonnaise, and onion powder. Serve on bread as sandwich or on greens as a salad.""]",american,main,omnivorous
Cube Steak With Onion Gravy,"[""Salt and pepper steak and dredge in flour."", ""Using a skillet, fry steak in oil only until just light brown on each side."", ""In same skillet add water, ketchup and worcestershire sauce and let simmer on low heat for 15 to 20 minutes."", ""Add onion rings and simmer 10 minutes."", ""Push steak and onions to one side in skillet. Using Pillsbury gravy flour, whisk in vigorously while gravy is bubbling and simmer 5 more minutes. (This flour is the secret to not having lumps in your gravy.).""]",southern american,main,omnivorous
Peanut Butter Pie,"[""Mix"", ""listed"", ""ingredients then fold in 18 ounces whipped topping."", ""Pour into 3 graham cracker pie crust shells."", ""Freeze and serve frozen.""]",american,dessert,vegetarian
Pineapple Dressing,"[""Cream butter and sugar; add egg and then pineapple."", ""Mix well. Fold in bread."", ""Pour into 1 1/2-quart greased casserole dish."", ""Bake at 350\u00b0 for 1 hour.""]",western,dessert,vegetarian
Pear Apple Crisp,"[""In a greased 9-in. square baking dish, combine pie filling and pears; set aside. In a small bowl, combine the brown sugar, flour oats and cinnamon; cut in butter until mixture resembles coarse crumbs. Sprinkle over fruit. Bake at 350\u00b0 for 23-25 minutes or until golden brown. Serve with ice cream if desired.""]",american,dessert,vegetarian
Brownies,"[""In a 3-quart saucepan, melt chocolate and butter or margarine. Remove from heat."", ""(Mix the rest of the ingredients in by hand.) Add sugar and mix well."", ""Add each egg, one at a time, mixing well after each one."", ""Add vanilla."", ""Add flour and mix well."", ""Add pecans."", ""Spray just the bottom of a 13 x 9 x 3-inch pan with Pam. Bake at 350\u00b0 for 25 minutes or until toothpick comes clean.""]",american,dessert,omnivorous
"Moroccan Tagine of Chicken with Prunes, Apricots, and Almonds","[""Heat the oil in a Dutch oven or other large, heavy frying pan with a cover."", ""Add the onions, and saute slowly until golden."", ""While the onions are cooking, season the chicken pieces well with salt and pepper, and sprinkle with cinnamon."", ""Push aside the onions and tuck the chicken pieces into the pan."", ""Brown them well on all sides."", ""Add the prunes, raisins, and apricots to the chicken pieces, along with the saffron, cumin, and paprika, and a cup of water."", ""Simmer, covered, stirring occasionally, for about 40 minutes, or until the chicken is cooked and most of the liquid has evaporated."", ""(Add more water if necessary.)"", ""Just before serving, toast the almonds in the microwave for 3 minutes, and sprinkle them over the chicken."", ""Serve with saffron rice (see page 278).""]",moroccan,main,omnivorous
Coconut Snowballs,"[""Preheat oven to 400\u00b0. Beat butter and sugar at medium speed with an electric mixer until creamy. Add extract; beat 30 seconds. Gradually add flour, beating at low speed until combined after each addition. Stir in shredded coconut. (If dough is soft, divide in half, and chill 30 minutes to 5 days.)"", ""Drop dough by level spoonfuls about 2 inches apart onto 2 parchment paper-lined baking sheets, using a 1-inch cookie scoop."", ""Bake, in batches, at 400\u00b0 for 7 to 9 minutes or until cookies are golden brown on bottom. Cool completely on a wire rack (about 30 minutes). Spread each cooled cookie with about 1/2 tsp. melted chocolate.""]",american,dessert,vegetarian
Easy Artichoke Dip Recipe,"[""Adjust oven rack to middle position and preheat oven to 350\u00b0 F."", ""Combine artichokes, mayonnaise, Parmesan cheese, garlic, Worcestershire sauce and salt in medium bowl. Spoon into 1-quart casserole dish. Bake 30 minutes until hot a bubbly. Sprinkle with parsley and chopped tomatoes. Serve with crackers or toasted bread slices.""]",american,side,vegetarian
Mexican Pie,"[""Pat one can crescent rolls out in bottom of pie plate to make crust."", ""Add drained meat mixture."", ""Cover with very thin sliced and peeled fresh tomatoes."", ""Add chopped green chilies."", ""Add grated cheese to top of this mixture in pie plate.""]",mexican,main,omnivorous
Griddled Courgette Salad With Mozzarella and Mint,"[""Brush the courgettes with olive oil and cook them in batches on a hot griddle or under a grill until just tender (2-3 minutes per side)."", ""Keep the cooked slices warm and covered until they are all done."", ""Combine all of the dressing ingredients in a bowl and season well."", ""Divide the courgette, mozzarella, pickled lemon and mint between 6 plates."", ""Pour over the dressing and serve with crusty bread for mopping up the juice.""]",italian,side,vegetarian
Pumpkin Spice Breakfast Cakes,"[""Preheat oven to 350F."", ""Cream butter and sugar together until light and fluffy. Add egg and mix until well combined. Add in vanilla and pumpkin. Mix dry ingredients together and add to pumpkin batter, only mixing until just combined."", ""Spray 2 (individual serving sized) ramekins with non-stick spray and pour batter into them. Bake for 30-35 minutes or until inserted toothpick comes out clean."", ""For the glaze:"", ""Mix syrup, water and sugar together to form a glaze. Depending on desired consistency, add more or less liquid. Drizzle over cooled cakes.""]",american,main,omnivorous
Last-Minute Spinach Dip,"[""Heat oven to 350\u00b0 F."", ""Brush both sides of each pita with some of the oil and sprinkle with the salt. Cut each pita into 6 triangles and transfer to a baking sheet. Bake until golden, about 10 minutes."", ""Meanwhile, squeeze the spinach to remove any excess water. In a food processor or blender, puree the spinach and hummus. Spoon into a dish and serve with the pita chips.""]",american,starter,vegetarian
Miss Kitty'S Kielbasa & Sauerkraut,"[""Place all ingredients (except potatoes) in a large stockpot and simmer on medium low heat for 1 - 2 hours to combine all flavors."", ""Add potatoes the last 30 minutes of cooking. Cook until potatoes are tender."", ""OR add all ingredients to large crockpot."", ""Cook on low setting 4-6 hours.""]",polish,main,omnivorous
"Veggie ""chicken"" and Broccoli Casserole","[""Bring a large pot of lightly salted water to a boil."", ""Add pasta and cook for 6 to 8 minutes or until al dente; drain."", ""Preheat oven to 400 degrees F (200 degrees C.) Grease a 9x13 inch casserole dish."", ""Melt butter in a large saucepan over medium heat."", ""Saute onion until tender, about 3 minutes."", ""Mix in flour."", ""Gradually stir in broth."", ""Slowly stir in milk, and cook, stirring, until sauce begins to thicken."", ""Season with salt and pepper."", ""Place cooked noodles in the bottom of casserole dish."", ""Arrange chickn in an even layer over noodles."", ""Place broccoli over the chickn."", ""Pour sauce evenly over the broccoli."", ""Sprinkle half the cheese over casserole."", ""Bake in preheated oven for 20 minutes, or until the cheese melts."", ""Remove from oven, and sprinkle with remaining cheese."", ""Allow to set for 5 minutes, until cheese melts.""]",american,main,vegetarian
Creamed Spinach,"[""Pick over the spinach to remove and discard any tough stems or blemished leaves."", ""Rinse well and drain."", ""Bring water to the boil and add the spinach."", ""Let cook 2 minutes and drain, pressing or squeezing to extract as much liquid as possible from the leaves."", ""Heat 1 tablespoon of the butter in a saucepan and add the flour, stirring with a wire whisk."", ""When blended add the milk, stirring vigorously with the whisk."", ""Cook, stirring, until the mixture is thickened and smooth."", ""Add salt, pepper, nutmeg and cayenne pepper."", ""Put the spinach into the container of a food processor and blend thoroughly, stirring down as necessary."", ""There should be about 1 cup."", ""Put the spinach in the sauce and stir to blend."", ""Bring to the simmer and swirl in the remaining tablespoon butter.""]",french,side,vegetarian
Sriracha Potato Salad,"[""Boil potatoes until fork tender."", ""Submerge in ice water to stop the cooking process."", ""Drain."", ""Pat dry."", ""Combine mayonnaise, Sriracha, vinegar, and dry seasonings in a large mixing bowl."", ""Toss potatoes and veggies with dressing and fresh basil."", ""*Optional: Sweat veggies and garlic in olive oil until tender."", ""Variations; Sausage, chicken, lemongrass, shallots, roasted bell peppers""]",american,side,omnivorous
Chocolate Cake V,"[""Preheat oven to 350 degrees F (175 degrees C). Grease and flour a 9x13 inch pan. In a small bowl, dissolve the cocoa in the hot coffee; set aside. Sift together the flour, baking soda, baking powder and salt. Set aside."", ""In a large bowl, combine the sugar, oil, eggs and vanilla. Beat in the flour mixture alternately with the cocoa mixture. Pour batter into prepared pan."", ""Bake in the preheated oven for 40 to 50 minutes, or until a toothpick inserted into the center of the cake comes out clean. Allow to cool.""]",american,dessert,vegetarian
Cream Of Potato Soup,"[""In a Dutch oven, boil until almost done potatoes, celery and onion."", ""Drain and return to Dutch oven."", ""Add enough milk to cover vegetables, plus 1/2-inch."", ""Add ham, margarine and spices."", ""Simmer until potatoes are tender and almost ready to flake apart."", ""May be made thicker with cornstarch/water or flour/water if desired.""]",american,main,vegetarian
Old Fashioned Coconut Pie,"[""Preheat oven to 350 degrees."", ""In a large bowl combine the milk, sugar, coconut, eggs, flour, butter and coconut extract."", ""Stir until well incorporated."", ""Pour into the unbaked pie shell."", ""Bake for 45 minutes or until a knife inserted 1 inch from the center comes out clean."", ""Remove and place on a wire rack to cool to room temperature."", ""In a medium bowl combine the apricot preserves and vanilla."", ""Add the cream and beat until stiff."", ""Spread this over the cooled pie and garnish with toasted coconut."", ""Serve.""]",southern,dessert,omnivorous
Michael C's Millionaire's Shortbread,"[""Grease a 23cm square cake tin with butter."", ""Sift the flour into a bowl and rub the butter in with your fingertips until the mix resembles fine breadcrumbs."", ""Add the sugar and mix to form a firm dough."", ""Press the dough into the base of the prepared tin and prick all over with a fork."", ""Bake in a preheated oven at 190C for 20 minutes, until lightly golden."", ""Leave the shortbread to cool in the tin."", ""To make the topping, place the butter, sugar and condensed milk in a non-stick saucepan and cook over a gentle heat, stirring constantly, until the mix comes to a boil."", ""Reduce heat and cook for 4-5 minutes, until the caramel is pale golden and thick and is coming away from the sides of the pan."", ""Pour the caramel over the shortbread base and leave to cool."", ""When the caramel is firm, melt the chocolate and spread over the caramel layer."", ""Leave to cool."", ""Cut into squares or fingers and gently take out.""]",british,dessert,vegetarian
Pumpkin Spiced And Iced Cookies,"[""Heat oven to 375\u00b0F and grease cookie sheets."", ""Combine flour, pumpkin pie spice, baking powder, baking soda, and salt in medium bowl."", ""Beat butter and sugar in large bowl with mixer till creamy. Beat in pumpkin, eggs and vanilla. gradually beat in flour mixture. Stir in morsels and nuts."", ""Drop by rounded tablespoonfuls on sheets. Bake 15-20 minutes till edges are brown. Cool on sheets for 2 minutes; remove to racks cool completely. Spread on glaze."", ""Glaze: Combine 1 cup powdered sugar, 1- 1/2 tbsp milk and 1/2 tsp vanilla in small bowl; mix well.""]",american,dessert,vegetarian
4th Generation Cheese Ball,"[""Mix first 6 ingredients together."", ""Form mixture into a ball."", ""Roll ball around in walnuts until covered."", ""Chill for at least 1 hour."", ""Serve with crackers.""]",american,appetizer,vegetarian
