recipename,instructions,cuisine,course_type,dietary_preference
Peas With Water Chestnuts(Microwave)  ,"[""Place onion, bouillon cubes and water in 1 1/2-quart casserole."", ""Cook, covered, on Full power for 2 to 4 minutes or until tender."", ""Add flour to onion."", ""Cook, covered, on Full power for 1 to 2 minutes, or until thickened."", ""Add peas, water chestnuts and salt."", ""Cook, covered, on Full power for 7 to 9 minutes, or until peas are tender.""]",chinese,side,vegetarian
Little Ham Crescents,"[""In a medium bowl combine ham, sour cream, tarragon, and white pepper; mix well and set aside."", ""Place patty shells one on top of the other."", ""Press lightly to seal together."", ""On lightly floured board, roll out dough to a 1/16th inch thick; cut into 16 4-inch squares."", ""Place about l teaspoon of ham mixture in center."", ""Roll up like a crescent, turning ends in slightly."", ""If desired brush tops with a beaten egg yolk mixed with water."", ""Place on jelly roll pan."", ""Bake in a preheated 375F oven until golden, about 15 to 20 minutes."", ""Serve hot.""]",american,side,omnivorous
Stuffed Mushrooms,"[""Brown meat and add celery; brown a few minutes."", ""Put in bowl with bread, parsley and beaten egg."", ""Fill mushrooms and bake in a well buttered pan 1/2 hour or until desired doneness.""]",italian,starter,omnivorous
Apple-Orange Cider,"[""Combine the first 4 ingredients in a 2-quart saucepan."", ""Cook over medium heat until thoroughly heated."", ""Serve hot."", ""Serve with cinnamon sticks, if desired."", ""Yields 1 quart.""]",american,beverage,vegan
Swiss Woods Souffle,"[""Distribute bread pieces evenly over bottom of baking dish."", ""Mix eggs with 1 1/2 cup milk and spices; pour over bread and let stand. Meanwhile brown and drain sausage."", ""Spread meat over bread. Combine soup, 1/2 cup milk and cheese; spread over sausage."", ""Bake at 350\u00b0 for about 45 minutes or until brown."", ""Let stand for 5 minutes.""]",swiss,main,omnivorous
New Green Bean Casserole,"[""Preheat the oven to 500F Coat a medium baking dish with cooking spray."", ""Coat a baking sheet with cooking spray."", ""Place the buttermilk in a shallow bowl."", ""Place the bread crumbs in another shallow bowl."", ""Dip the onion rings into the buttermilk, then dredge in the bread crumbs and place on the baking sheet."", ""Coat lightly with cooking spray."", ""Bake for 20 minutes, or until tender and golden brown."", ""Meanwhile, coat a medium saucepan with cooking spray."", ""Set over medium heat."", ""Add the mushrooms, chopped onion, thyme, and salt."", ""Coat with cooking spray."", ""Cook, stirring occasionally, for 4 to 5 minutes, or until the mushrooms give off liquid."", ""Sprinkle with the flour."", ""Cook, stirring, for 1 minute."", ""Add the milk."", ""Cook, stirring constantly, for 3 to 4 minutes, or until thickened."", ""Add the green beans."", ""Stir to mix"", ""Reduce the oven temperature to 400F Pour the bean mixture into the prepared baking dish."", ""Scatter the onion rings over the top."", ""Bake for 25 to 30 minutes, or until hot and bubbly.""]",american,side,omnivorous
Devilicious Game Ball,"[""In a bowl combine all ingredients except pecans."", ""Shape mixture like a football."", ""Chill."", ""Roll in chopped pecans."", ""Add pimento or string cheese for decoration."", ""Serve with crackers. Makes one (2-cup) cheese ball.""]",american,starter,omnivorous
Stuffed Shells with Chicken and Arugula and Creamy Alfredo Sauce,"[""Preheat oven to 350 degrees F. Butter a 9 by 13-inch glass baking dish and set aside."", ""Bring a large pot of water to a boil add the pasta shells and cook for approximately 9 minutes until al dente."", ""Drain and rinse under cold water being careful not to break the shells."", ""Set aside."", ""Meanwhile prepare the filling."", ""In a large bowl mix together the ricotta and Parmesan."", ""Heat oil in a medium skillet over medium heat, add the garlic, and cook 1 minute, being careful not to brown it."", ""Stir in the arugula until just wilted, about 2 minutes."", ""Add the chopped chicken and stir well."", ""Remove from heat and let cool for about 10 minutes."", ""Add chicken mixture to cheese mixture and stir carefully."", ""Stuff each shell with approximately 1/2 cup of the cheese filling and place in prepared baking dish."", ""For sauce, heat the butter in medium saucepan over medium heat."", ""Add the garlic and cook for about 1 minute until fragrant but not brown."", ""Add the flour and whisk until smooth."", ""Gradually add the cream and milk and whisk until mixture begins to thicken and bubble."", ""Remove from heat and add the chives, 1 cup Parmesan, cherry tomatoes and stir gently."", ""Pour sauce over shells and sprinkle with remaining 3 tablespoons of Parmesan."", ""Bake for 30 minutes until the sauce is bubbling and cheese is golden brown."", ""Sprinkle with parsley."", ""FNK notes: recipe makes too much filling""]",italian,main,omnivorous
Chocolate Chip Cake,"[""Preheat oven to 350 degrees."", ""Grease and flour a Bundt pan, I use Baker's Joy Spray."", ""Combine cake mix, pudding mix, eggs, vegetable oil, milk and vanilla extract."", ""Mix at medium speed for 4 minutes."", ""Fold in semi sweet morsels (and nuts) until well scattered in batter."", ""Pour into pan."", ""Bake for 1 hour or until cake pulls away from side of pan."", ""Cool in pan for 15 minutes then remove from pan to a wire rack."", ""Sprinkle with confectioners' sugar."", ""No frosting needed!""]",american,dessert,omnivorous
Greens With Sesame and Ginger,"[""Heat oil in wok; stir fry garlic and ginger until browned."", ""Add mushrooms and Napa cabbage; stir 1 minute then add bok choy and tsp soy sauce."", ""Cover 1 minute."", ""Add soy sauce and vinegar and stir fry 1 minute."", ""When served, sprinkle sesame seeds.""]",asian,side,vegan
Hamburger Chow Mein,"[""Brown meat, onions and celery in butter in a large, heavy skillet until meat loses red color and onions are tender."", ""Mix in soups (undiluted), rice, water and soy sauce."", ""Pour into greased casserole."", ""Cover; bake at 350\u00b0 for 1 hour."", ""Uncover; sprinkle with Chinese noodles."", ""Bake, uncovered, for 15 minutes longer. Yields 6 to 8 servings.""]",american,main,omnivorous
Kfc Biscuits (Copycat),"[""PREHEAT oven to 400\u00b0F; COMBINE 2 cups all-purpose flour, 1 1/2 teaspoons salt, 1 tablespoon sugar, 4 teaspoons baking powder and 1/4 teaspoon baking soda in a large mixing bowl; CUT in shortenings until mixture resembles coarse crumbs."", ""STIR in 1 cup buttermilk just until a soft dough forms (dough will be very loose and sticky at this point)."", ""SPRINKLE flour over a large wooden board; TURN dough onto a floured board and knead gently 10 to 12 times or until no longer sticky, re-flouring board as necessary while kneading."", ""DIVIDE dough in half; GENTLY pat or roll each half into an 8-inch circle 1/2-inch thick."", ""CUT out biscuits - pressing straight down - with a 2-inch biscuit cutter."", ""REFORM scraps, working it as little as possible and continue cutting."", ""PLACE cut biscuits on an ungreased baking sheet with edges barely touching; BRUSH tops of the biscuits with whole milk."", ""BAKE for 15 minutes, or until golden brown."", ""IMMEDIATELY brush biscuits with margarine (or butter) after baking."", ""SERVE hot and enjoy.""]",american,side,omnivorous
Red Snapper In Coconut Sauce,"[""Season snapper, if desired, with salt and pepper. Heat 1 tablespoon olive oil in large nonstick skillet over medium-high heat and cook snapper in batches until golden, turning once, about 4 minutes. Remove snapper and set aside."", """", ""Heat remaining 1 tablespoon olive oil over medium heat and cook onion, jalapeno and ginger, stirring occasionally, until onion is tender, about 5 minutes. Stir in tomato and cook 2 minutes. Stir in coconut milk and Knorr(R) Reduced Sodium Chicken flavor Bouillon. Return snapper to skillet and bring to a boil. Reduce heat and simmer covered 4 minutes or until fish flakes easily with fork. Stir in lime juice. Garnish with cilantro.""]",caribbean,main,omnivorous
Ployes: French Buckwheat Pancakes,"[""Mix dry ingredients."", ""Add cold water and let stand for 10 minutes."", ""Add boiling water and drop to make thin 6\"" pancakes on hot griddle, 400 degrees I use ungreased cast iron fry pan or non-stick electric griddle, ungreased."", ""Bake on one side only, until bubbles break and pancake is firm."", ""Serve on warm platter.""]",french,main,vegan
No Bake Cookies,"[""Mix together sugar, butter and milk."", ""Bring to a boil; remove from the heat."", ""Add oatmeal, peanut butter, cocoa and vanilla. Mix together."", ""Drop by spoonfuls onto waxed paper."", ""Let set at least 30 minutes.""]",american,dessert,vegetarian
Cauliflower With Garlic And Anchovies,"[""Separate the cauliflower into florets."", ""Bring a large pan of water to a boil and add a generous amount of salt and the bay leaf."", ""Add the cauliflower for 2-3 minutes to blanch, then drain and set aside."", ""Chop the celery stalks finely and set aside."", ""Chop the leaves (if using) separately and set aside."", ""Heat 3 Tbs of the oil in a large skillet."", ""Add the celery stalks and sautee for 1 minute."", ""Add the cauliflower and re-season with salt."", ""Cook for 2-3 minutes over medium-high heat, without stirring -- you want the cauliflower to brown."", ""If needed, added more oil (I generally don't), then the anchovies and cook for 2-3 minutes more."", ""Add the garlic, stir well, and cook for another 30 seconds -- you don't want the garlic to burn."", ""Remove from the heat and add the celery leaves, if you are using them."", ""Add the lemon juice and re-season with salt and pepper."", ""Add Tabasco if using, to taste."", ""May be served hot or at room temperature, either as a vegetarian entree or as a side dish -- Enjoy!""]",italian,side,omnivorous
Citrus Vinaigrette ,"[""Combine first 6 ingredients in a small jar; season vinaigrette to taste with salt and pepper. Shake to blend. DO AHEAD:""]",american,side,vegan
Saffron Soup,"[""Melt butter in a heavy-bottom soup kettle."", ""Add onions, garlic and saffron and cook over medium-low heat, stirring frequently, until onions are softened."", ""Do not let onions brown."", ""Bring chicken stock to a boil."", ""Add bread crumbs to onions and stir to mix thoroughly."", ""Add chicken stock and stir again."", ""Bring soup to a boil and immediately lower heat and simmer, covered, for 20 minutes."", ""Puree soup in a blender, food processor or fine-mesh food mill."", ""Strain soup, discarding solids."", ""Return to rinsed-out soup kettle."", ""Add cream and lemon juice."", ""Mix well and taste, adding salt and pepper if desired."", ""May be served immediately, or chilled and served as a summer soup.""]",persian,starter,omnivorous
"Date, Dried-Cherry and Chocolate Torte","[""Preheat oven to 375F."", ""Combine dates, cherries, and baking soda in a heatproof bowl, then stir in boiling water and brandy."", ""Whisk together flour, cocoa, and salt."", ""Beat together butter and sugar until pale and fluffy."", ""Add eggs 1 at a time, beating until just combined."", ""Beat in vanilla and zest."", ""Add half of flour mixture and beat at low speed until just combined."", ""Add date mixture with liquid and beat at low speed until just combined."", ""Add remaining flour mixture and beat until just combined."", ""Stir in chocolate and pecans."", ""Pour batter into a generously buttered 24-cm (9-inch) springform pan, smoothing top."", ""Bake in middle of oven until center is slightly rounded and top of torte is cracked (edges will be dark brown), about 55 minutes."", ""Let torte stand 5 minutes in pan on a rack."", ""Run a sharp small knife around side of pan to loosen, then remove side."", ""Cool torte on rack.""]",american,main,vegetarian
Cowboy Cookies,"[""Cream shortening and sugar."", ""Add eggs, flour, salt, soda, baking powder and then the rest of the ingredients."", ""Add oatmeal and chocolate or butterscotch chips last and gently stir in."", ""Drop by spoonfuls onto lightly greased cookie sheet."", ""Bake at 350\u00b0 for about 12 minutes.""]",american,dessert,omnivorous
"Peach, Plum, Pear.","[""Thinly slice fruit"", ""In small bowl combine with salt, sugar, cinnamon and butter."", ""Lightly toss."", ""Roll out dough, cut into strips 1 inch wide, then cut half way into thirds."", ""Place 1 slice each of fruit onto dough strip and fold dough over."", ""Repeat."", ""OPTIONAL: icing: over med low heat mix 1 cup powdered sugar with 1 tsp of vanilla and 1/2 cup of milk."", ""Whisk briskly until smooth and thickened."", ""Bake for 8-10 minutes at preheated oven temp instructed by pie crust box."", ""Let cool and drizzle with icing."", ""For shitz and giggles I garnished with a ridiculously small amount of parsely and tiny orange wedges for color."", ""To each their own.""]",american,dessert,vegan
Brine To Cure Ham Or Bacon,"[""Bring to boil and pour over meat."", ""Let stand in brine approximately 1 week for bacon and 2 weeks for ham.""]",western,main,omnivorous
Saté Chicken Salad ,"[""Pulse peanuts in a food processor until coarsely chopped, then transfer to a bowl."", ""With motor running, drop garlic and ginger through feed tube and finely chop. Add peanut butter, water, vinegar, soy sauce, sesame oil, sugar, and red-pepper flakes and blend until smooth."", ""Toss chicken and vegetables with enough dressing to coat, then sprinkle with peanuts and cilantro.""]",indonesian,main,omnivorous
Salmon India With Mango Salsa,"[""Season salmon with 1 teaspoon of cumin, 1/2 teaspoon of coriander, and 1/2 teaspoon masala and 1/4 teaspoon each salt and black pepper."", ""Drizzle with 1 tablespoon of lemon juice."", ""Cover loosely and let salmon stand 20 to 30 minutes."", ""Preheat broiler and broiler pan."", ""In a medium bowl, mix mango, jicama, bell pepper, chili pepper, 1 teaspoon of olive oil, 1 tablespoon of lemon juice, and remaining 1/2 teaspoon cumin, 1 teaspoon coriander and 1/4 teaspoon each salt and black pepper."", ""Mix gently and set aside until serving time."", ""Place salmon on preheated broiler pan and broil 3 to 4 inches from heat 3 to 4 minutes, without turning, or until fish is just opaque in thickest part."", ""In a small bowl or cup, whisk remaining 1 tablespoons lemon juice and 2 teaspoon olive oil."", ""To serve, divide watercress among four dinner plates and top with carrots."", ""Drizzle olive oil and lemon juice dressing over watercress and carrots."", ""Top greens with salmon and spoon salsa over salmon.""]",indian,main,omnivorous
Italian Marinade,"[""Combine all ingredients. Use to marinate poultry, beef, or lamb."", ""Place 1 (2-pound) flank steak and Italian Marinade in a large freezer bag. Seal; chill 2 hours. (Or freeze up to 6 months; thaw before grilling.) Grill, covered with grill lid, over medium-high heat (350\u00b0 to 400\u00b0) 8 minutes on each side or to desired degree of doneness. Cut into thin slices, and serve immediately."", ""Note: Other steak cuts may be used; grilling times will vary.""]",italian,side,omnivorous
Ann'S Peach Cobbler,"[""Mix sugar, flour and butter."", ""Put peaches in a 2-quart casserole dish, then put mixture over peaches."", ""Bake at 375\u00b0 until golden brown.""]",american,dessert,vegetarian
Barbecue Beer Bread,"[""Sift the flours and salt together in a bowl. Rub in the butter until the mixture looks like fine breadcrumbs."", ""Make a well in the centre, add the beer and milk and gradually mix together to make a soft dough."", ""Turn out on to a clean surface and knead briefly until smooth. Shape into a 10in round and place in the centre of a large, double-thickness sheet of oiled extra-thick foil."", ""Score the top of the bread in a criss-cross pattern and sprinkle with 1 tbsp of flour. Bring the edges of the foil together loosely to seal."", ""Place the foil parcel on to the barbecue rack and cook over medium-hot coals for 10 minutes on each side."", ""Open the foil parcel and fold back the edges. Sprinkle the top of the loaf with the cheese, spring onions and cayenne pepper and leave for another 5 minutes until the cheese has melted. Remove from the foil and serve cut into thick wedges.""]",american,side,vegetarian
Chicken And Broccoli Casserole,"[""Boil chicken breasts until meat starts to separate from bones. Remove breasts from stock."", ""Separate meat from bones; cut meat into 1-inch squares."", ""Spread meat over casserole dish."", ""Sprinkle broccoli over chicken."", ""Sprinkle dried beef over broccoli."", ""Mix can of chicken broth with cream of chicken soup and pour over broccoli."", ""Put pepper (bell) over top."", ""Mix dressing with chicken broth to moisten."", ""Spread over casserole; bake in 350\u00b0 oven for approximately 45 minutes, until dressing browns.""]",american,main,omnivorous
Lemon Squares,"[""In a smal mixer bowl beat butter or margarine until softened. Add 1/4 cup sugar and beat until fluffy."", ""Stir in 1 cup flour. Press dough onto the bottom of a greased 8 x 8 x 2-inch baking pan. Bake in a 350\u00b0 oven for 15 minutes."", ""Meanwhile, in the mixer bowl beat eggs."", ""Add 3/4 cup sugar, 2 tablespoons flour, lemon peel, lemon juice and baking powder."", ""Beat about 3 minutes or until slightly thickened."", ""Pour the lemon mixture over the baked layer. Return to the 350\u00b0 oven and bake for 25 to 30 minutes or until edges are light golden brown and center is set."", ""Cool."", ""If desired, sift powdered sugar over cookies."", ""Cut into squares."", ""Makes 16.""]",american,dessert,vegetarian
Ranger Cookies,"[""Sift flour, salt, baking soda, sugar and baking powder."", ""Add coconut, chopped nuts, oatmeal and brown sugar."", ""Work in butter. Add eggs and vanilla.""]",american,dessert,omnivorous
Stuffed Braised Manicotti Topped with Fresh Mozzarella,"[""Heat 1 tablespoon olive oil in saute pan."", ""Saute 2 teaspoons garlic, add ground pork and saute."", ""Add salami and heat through."", ""Stir in ricotta, diced mozzarella, parsley, and salt and pepper."", ""Use a pastry bag with no tip to stuff each manicotti with approximately 1/4 cup filling."", ""Heat remaining 1 tablespoon olive oil in saute pan."", ""Saute onion and remaining 2 teaspoons garlic."", ""Add tomatoes and their juice, salt and pepper, dried oregano and red wine."", ""Simmer about 30 minutes or until sauce is thickened and reduced to about 6 cups."", ""Stir in fresh basil."", ""Spread about 1 cup sauce on bottom of a hotel pan."", ""Arrange filled manicotti on top."", ""Cover with remaining sauce."", ""Bake uncovered about 20 minutes at 375F."", ""Remove from oven and top each pair of manicotti with 1 large slice of mozzarella."", ""Bake 5 minutes longer or until cheese melts."", ""Yield: 12 Servings.""]",italian,main,vegetarian
Country Cornbread,"[""Mix and beat all ingredients well."", ""Bake in greased pan or muffin tins."", ""Bake for 12 minutes or until brown at 475.""]",american,side,omnivorous
Orecchiette With Spicy Turkey Sausage And Broccoli Rabe,"[""Thinly slice green leaves of broccoli rabe, and cut stems into 2-inch pieces."", ""Bring 2 quarts water to a boil in a Dutch oven. Add pasta; cook 6 minutes. Add broccoli rabe leaves and stems; cook 5 minutes or until tender."", ""While pasta and broccoli rabe cook, remove casings from sausage. Heat a large nonstick skillet over medium-high heat. Coat pan with cooking spray. Add onion and garlic; saute 3 minutes or until tender. Add sausage; cook 7 minutes or until browned, stirring to crumble. Add broth and next 3 ingredients; bring to a boil. Drain pasta and broccoli rabe; stir hot cooked pasta, broccoli rabe, and tomatoes into sausage mixture; cook 1 minute or until thoroughly heated. Sprinkle with cheese; toss well."", ""Orecchiette (oh-ray-kee-EHT-tay), a pasta originally from the Puglia region, is named for its resemblance to \""little ears.\""""]",italian,main,omnivorous
Baked Beans,"[""Brown ground beef; mix all ingredients together."", ""Bake at 350\u00b0 for 45 minutes.""]",american,side,omnivorous
Grandma Tuzzolino'S Spedini,"[""Pound meat until thin."", ""Pieces should be 3 x 3-inches."", ""(You may use a small beef tenderloin roast, sliced thin."", ""It slices easily if partly frozen.)""]",italian,main,omnivorous
Cheeseburger Pie,"[""Preheat oven to 400\u00b0."", ""Lightly grease with shortening a 10 x 1/2-inch pie plate."", ""Cook crumbled beef and onion in skillet until brown, about 10 minutes. Drain, then stir in salt and pepper. Spread beef mixture in pie plate and sprinkle evenly with cheese. Beat milk, Bisquick and eggs until smooth."", ""Pour evenly into pie plate."", ""Bake until golden brown and knife inserted in center comes out clean, about 30 minutes."", ""Let stand 5 minutes before cutting. Garnish with pickle slice and catsup, if desired.""]",american,main,omnivorous
Squash Casserole,"[""Brown meat, squash and onions together with salt and pepper. Drain off juice."", ""Put in layers meat, cheese and oleo."", ""Pour in milk."", ""Place in 350\u00b0 oven until cheese is melted; brown if desired.""]",american,main,omnivorous
Pound Cake With Dulce De Leche Filling,"[""Preheat you oven to 350\u00b0F."", ""Cream butter and margarine with sugar."", ""While the butters and sugar cream mix in separated bowl flour an baking powder."", ""In an other bowl mix orange juice, vanilla and irich cream."", ""Pour egg yolks into the butter mixture, one at a time."", ""Mix in the dry ingredients and the wet ingredients alternating."", ""In a separate bowl, wisk the egg whites until they form soft peeks."", ""With a large spoon (wooden spoon or spatula) mix in the egg whites into the mixture."", ""Pour into the pan and bake for 40 to 50 minutes."", ""As soon as it comes out of the oven unmold it. (this will avoid over cooking)."", ""Let it cool for 30 mins, and divide it using a nylon thread."", ""The nylon thread technic, is very easy and accurate for us who are not too handy with the serrated knife. Just mark with toothpicks the midpoint on the side of your cake in 4 spots."", ""With a long string of nylon thread, holding it tight, place your right hand in one of the toothpicks and move the left hand around marks passing the thread thru the cake."", ""In a skillet toast the almonds for 5 mins, until they are crunchy."", ""Safe a 1/4 cup of dulce de leche and pour it onver one side of the cake"", ""sprinkle almonds over, and top it with the other side of the cake."", ""Enjoy.""]",latin american,dessert,omnivorous
Pomegranate & Spinach Persian Soup (?Sh ‘Eh Anar),"[""Heat 2 tablespoons of oil in a big nonstick pot and saute chopped onions over medium heat till golden. (Approximately 10 minutes.) Add split peas, 6-8 cups of filtered water, salt, pepper, and turmeric. Bring to a boil. Reduce heat and simmer (for around 15-20 minutes) until the split peas soften. Add rice and continue to cook for another 15 minutes. Stir occasionally to prevent sticking. Add the chopped greens and herbs and continue to cook for 10-15 minutes longer. Stir as needed. Add the pomegranate juice, simmer, covered, for 30-45 minutes."", ""To make the (optional) mini meatballs : mix 1/2 pound of ground meat with one grated onion; season with salt, pepper and 1/2 teaspoon of turmeric; knead well to mix. Make hazelnut-sized meatballs, roll meatballs in a thin layer of flour and saute briefly in hot oil in a pan. Add to the soup at the same time you add the pomegranate juice in step #2. (Alternatively: instead of meatballs, add cubed beets to the ?sh.)"", ""Once the ?sh is set to your liking, taste and adjust flavor: add sugar (anywhere from 2 tablespoons up to 1/3 cup to taste) or conversely, add more pomegranate syrup/juice to amp up the tart flavor. Your call. Traditionally, a tart (yet not sour) flavor is preferred. [NOTE: If the ?sh is too thick at any time throughout the process add a bit of water to dilute. Don't forget to stir occasionally throughout to prevent sticking.]"", ""Serve when hot and transfer soup into a big serving bowl. Just before serving, prepare the traditional (& heavnely) sauteed dried mint and garlic (na'na dagh) garnish: a) Heat 1 tablespoon of oil in a pan. Once oil sizzles, turn heat off completely, add the dried mint, and stir in the pan for just one minute. (Dried mint is prone to burning quickly, so that one minute is more than enough.) Remove mint from pan and set aside. b) In the same pan, heat another tablespoon of oil till sizzling hot. Add sliced garlic, stir, and saute for just around a minute. (Don't overdo it as garlic will lose its aroma.) Top serving bowl of pomegranate and spinach ?sh with a criss-cross pattern of the mint and garlic garnish. Decorate with a hanful of pomegrante arils if you wish. Enjoy and nush 'e jan!""]",persian,starter,vegetarian
Easy Flavourful Tri-Colour Rice Bowl,"[""Boil green beans in salted boiling water."", ""Transfer to a plate, drizzle mentsuyu noodle dipping sauce, and sprinkle white sesame seeds."", ""Break the eggs into a bowl, add mayonnaise, sugar, salt and pepper, and mix."", ""Heat oil in a frying pan, and pour in the egg mixture."", ""Adjust the heat so that it won't get scorched."", ""Stir well, and when it's done, transfer to a plate."", ""When you mix the mixture with a whisk, it becomes crumbly and fluffy."", ""When you use chopsticks, you will have larger pieces of scrambled eggs, and they are satisfying."", ""Pour oil in the pan, and add garlic and ginger."", ""When fragrant, add ground meat."", ""When the colour of the meat changes, add sugar first."", ""Then after 1 minute, add mirin and soy sauce."", ""Simmer over low heat to let the meat absorb the sauce."", ""Simmer until there is only a small amount of liquid left."", ""Put rice in a bowl, and pour over the sauce where the meat goes."", ""Place the green beans, eggs, and ground meat on top, then it's done.""]",asian,main,omnivorous
