recipename,instructions,cuisine,course_type,dietary_preference
How to Make Rice in a Frying Pan,"[""Wash and soak the rice as usual and then add it to a frying pan."", ""Pour about 5mm-1cm of water over the rice."", ""Cover with a lid and turn the heat to high."", ""Once it comes to a boil, lower the heat and let it simmer for 5 minutes."", ""Here's how it looks after 5 minutes."", ""Once the rice has become plump, turn the heat to high until the frying pan begins to sizzle."", ""Stop the heat and let it steam for 10 minutes."", ""Stir it up to evaporate the remaining liquid and enjoy."", ""By the way, it doesn't retain heat very well, so pack it into a container with the steam while still hot."", ""Once it has cooled, store in the freezer."", ""Related recipes: Boiled Egg in Half a Cup of Water, How to Boil Spinach"", ""By the way, you can make a very nice poached egg if you cover an egg with plastic wrap and add to the pot as the rice is steaming for 10 minutes."", ""Please try it out if you want!""]",asian,side,vegan
Veggie Pizza,"[""Heat oven to 375\u00b0."", ""Join dough pieces and spread over a jelly roll pan and bake for 8 to 10 minutes until golden brown and allow to cool."", ""Cream sour cream, Ranch dressing, onions and cream cheese."", ""Spread creamed mixture across the pastry."", ""Add a variety of chopped fresh vegetables to top the pastry."", ""Cut to appetizer size pieces and chill.""]",italian,main,vegetarian
Chocolate Pixies,"[""In small saucepan, melt butter and chocolate over low heat, 8 to 10 minutes."", ""Cool."", ""In large mixer bowl, combine melted chocolate mixture, 1 cup (225 ml) of the flour, granulated sugar, eggs, baking powder and salt."", ""Beat at medium speed, scraping bowl often, until well mixed, 2 to 3 minutes."", ""Stir in remaining 1 cup (225 ml) flour and the nuts."", ""Cover; refrigerate until firm, at least 2 hours."", ""Heat oven to 300 deg."", ""Shape rounded tspfuls of dough into 1-inch balls; roll in powdered sugar."", ""Place 2 inches apart on greased cookie sheets."", ""Bake for 12 to 15 minutes, or until firm to the touch."", ""Remove immediately.""]",american,dessert,vegetarian
Black Bean Tostados ,"[""1. In a frying pan, warm oil over medium heat. Add garlic, onion, and red pepper and cook, stirring occasionally, until onion is softened, 8 to 10 minutes. Stir in ground chile and cumin and cook until fragrant, about 1 minute."", ""2. Drain beans, reserving their liquid, and add to pan along with about 1/2 cup liquid. Stir and mash until beans form a slightly chunky puree and are heated through, about 3 minutes."", ""3. To assemble tostadas, top each shell with 1/2 cup bean mixture, a few radishes, avocado slices, and cheese. Serve with lime wedges and salsa and/or sour cream."", ""*Find in Latino markets and well-stocked grocery stores.""]",mexican,main,vegan
Homemade Butter,"[""Lay margarine out at room temperature and let soften."", ""Mix all ingredients."", ""Beat until fluffy."", ""Place in fridge to cool.""]",american,side,vegetarian
Orange Barbecue Sauce,"[""Mix all ingredients until well blended."", ""Use as grilling sauce for poultry, ribs, pork tenderloin or chops.""]",american,side,omnivorous
Chocolate Mandarin Orange Cheese Cake Recipe,"[""Crust: Crush graham crackers fine; fold in 6 Tbsp."", ""melted butter and 4 Tbsp."", ""sugar."", ""Mix well."", ""Press into bottom of spring-form pan."", ""Cheese Cake: Cream cream cheese and 1 c. sugar."", ""Add in 1 egg at a time."", ""Beat till very smooth."", ""Heat chocolate chips and chocolate squares and 2 Tbsp."", ""butter; stir over low heat."", ""Add in to cream cheese mix."", ""In food processor, add in oranges, orange rind, extract, and 3 Tbsp."", ""sugar."", ""Mix till totally liquid."", ""Spoon liquid into chocolate cheese mix."", ""Mix gently."", ""Pour onto crust."", ""Bake at 450 degrees for 10 min then at 250 degrees for approximately 50 min."", ""Turn off oven."", ""Leave door ajar, leaving cheese cake in till edges begin to pull away from sides of pan."", ""Cold thoroughly.""]",american,dessert,vegetarian
Clam Chowder with Buttered Croutons,"[""Wash well and drain: 2 pounds clams."", ""Place in a heavy pot with 1/3 cup water."", ""Cover and cook over medium-high heat until the clams open."", ""Remove the clams from the pot."", ""When cool, remove the clams from their shells."", ""If they are big clams, chop them; other wise, leave them whole."", ""Strain the liquor left in the pot through a couple layers of cheesecloth."", ""Peel and cut into small cubes: 1/4 pound potatoes (about 3/4 cup, cubed)."", ""Cook the potatoes in salted boiling water until almost done."", ""Drain and set aside."", ""Heat in a heavy soup pot: 2 teaspoons butter."", ""When melted, add: 1 1/2 slices bacon, cut crosswise into 1/4-inch pieces."", ""Cook over medium heat until almost crisp."", ""Remove the bacon pieces and add: 1 onion, diced fine, 2 thyme sprigs, leaves only."", ""Cook for a few minutes and add: 1 small celery stalk, diced fine."", ""Continue cooking, stirring now and then, until the onions are soft and golden."", ""Season with: Salt, Fresh-ground black pepper."", ""Add the potatoes and bacon and cook for a couple of minutes."", ""Add the clams with their liquor."", ""Heat to a boil, immediately turn down to a simmer, and cook until the potatoes are soft, about 3 or 4 minutes."", ""Pour in: 3/4 cup milk, 1/3 cup cream."", ""Heat gently, but do not allow the chowder to come to a boil."", ""Taste for seasoning and adjust as needed."", ""Serve garnished with: Buttered croutons (see page 58), Fresh-ground black pepper."", ""Use mussels instead of clams."", ""Make a fish chowder."", ""Cut fish fillets into bite-size pieces and use water or fish stock instead of the clam liquor.""]",american,main,omnivorous
Sour Cream White Fudge,"[""Combine first 5 ingredients."", ""Bring slowly to a boil, stirring until sugar melts."", ""Do not boil anymore, but cook slowly to 236\u00b0 or to a soft ball stage."", ""Let stand 15 minutes, then add vanilla and nuts."", ""Beat until mixture loses its gloss and pour into lightly buttered 8 x 8-inch pan."", ""Score warm, then cut into squares when cooled.""]",american,dessert,vegetarian
Sugar Cookies,"[""Cream sugar and butter; add eggs and beat well."", ""Add milk and flour, sifted with soda, baking powder and salt."", ""Add vanilla. Mix and drop by teaspoon onto greased cookie sheet."", ""Bake at 375\u00b0 for 10 minutes or until brown.""]",american,dessert,omnivorous
Suji Halwa,"[""*Note that the recipe generally calls for 8 tablespoons of ghee (clarified butter), so if you keep ghee on hand, go for it. I don't, so we used regular butter instead. And since I figured I'd end up eating a lot of the batch myself (as per usual), I opted for 5 tablespoons instead of 8, which makes for the yummy, more crumbly texture shown here."", ""Crush cardamom pods with mortar and pestle to separate the pods from the seeds. Set aside."", ""Add 2 cups water, plus sugar and cardamom pods (not seeds) to saucepan on medium-high heat. Let water come to a full boil, stirring occasionally to ensure sugar melts into the water. Then reduce heat to medium-low and let it continue to boil gently."", ""In a large frying pan, dry roast suji on medium heat until light brown and fragrant, stirring constantly. This will take 2 to 4 minutes."", ""Add butter, cardamom seeds and 1 tablespoon almonds to frying pan and cook for another 2 to 4 minutes until the butter is fully incorporated into the semolina, stirring constantly."", ""Reduce saucepan heat to low and remove cardamom pods. Slowly add water-sugar mixture to frying pan little by little (since it will sizzle), stirring often. Continue to cook and stir for 2 to 4 minutes. It's done when the water is absorbed and the halwa mixture separates in a mass and leaves some butter visible at the sides of the pan."", ""Let cool just a tad and scoop into dishes. Then crush pistachio with mortar and pestle and use it to garnish, along with remaining almond slivers.""]",indian,dessert,vegetarian
Chicken Hotpot,"[""Preheat the oven to 400F"", ""Joint the chicken into 8 pieces."", ""Heat the dripping or butter in a frying pan, add the chicken and colour on both sides to seal - you may have to do this in batches."", ""Remove from the pan and put in an ovenproof casserole dish."", ""In the same frying pan, melt 1/4 of the butter over a medium heat."", ""Tip in the carrots and scallions and cook without colouring for about 3-5 minutes."", ""Scatter the carrots, scallions, peas and crushed garlic over the chicken."", ""Pour on the hot stock and season."", ""Coat the potatoes with 1/2 of the melted butter and place half the potatoes over the chicken to make a level topping; season to taste."", ""Carefully lay the rest of the potatoes decoratively on top."", ""Brush with the remaining melted butter."", ""Bake for 15 minutes and then reduce the heat to 375F Cook for a further hour, brushing with butter regularly."", ""If the potatoes begin to brown too much, cover with kitchen foil."", ""Remove the hot pot from the oven, sprinkle with chopped parsley and serve with cold pickled red cabbage.""]",british,main,omnivorous
Baked Acorn Squash,"[""Cut squash in half, and remove seeds."", ""Combineremaining ingredients, and spoon into squash halves, place squash halves in slow cooker."", ""Cover, and cook on low for 5-6 hours, or until squash is tender.""]",american,side,vegetarian
Apple Pie,"[""Combine sugar, flour, cinnamon, lemon juice and apples in bowl; mix together until apples are coated."", ""Make crust; line 9-inch pie plate."", ""Fill with apple mixture; dot with butter."", ""Adjust top crust, cutting slits for escape of steam; seal."", ""Sprinkle with sugar."", ""Bake at 400\u00b0 for 50 minutes or until done."", ""Put foil over edges to prevent over browning.""]",american,dessert,vegetarian
Soft Ginger Creams ,"[""1. In a large mixing bowl, beat the shortening with a mixer for 30 seconds."", """", ""2. Add the sugar, ginger, baking soda, nutmeg cinnamon, cloves and salt."", """", ""3. Beat until combined, occasionally scraping the sides of the bowl."", """", ""4. Beat in the egg, molasses and water on low speed until combined."", """", ""5. Using the mixer, beat in as much of the flour as you can."", """", ""6. Stir in any remaining flour by hand. Cover and chill the dough for 3 hours. Dough will be soft."", """", ""7. Drop the dough by the rounded teaspoon (keep them small) 2 inches apart on greased cookie sheets. Chill the formed cookies an additional 30 minutes before baking."", """", ""8. Preheat the oven to 375'"", ""while the cookies chill."", """", ""9. Bake at 375'for 8 minutes"", ""or until the edges are firm. Allow to cool on wire racks."", """", ""10. Frost with icing."", """", ""Icing: ln a mixing bowl, combine the powdered"", ""sugar, melted butter and milk. Stir in additional"", ""milk if needed. Drizzle over the cooled cookies.""]",american,dessert,omnivorous
Refreshing Octopus and Wakame Salad,"[""Cut wakame into bite-sized pieces."", ""Rehydrate in water if using dried wakame."", ""Cut the octopus into thin slices."", ""Mix the wakame and octopus in a bowl."", ""Serve on a plate and pour \""Riken\"" oil-free shiso leaf dressing, and you're done.""]",japanese,side,omnivorous
Green Bean Casserole - Best Ever ,"[""Rinse, trim and cut green beans in half. Bring a gallon of water and 2 tbsp of salt to a boil in an 8-quart saucepan. Add the beans and blanch for 5 minutes. Drain, and immediately plunge the beans into a large bowl of ice water to stop cooking. Drain and set aside."", """", ""Fry bacon strips until fairly crisp in a 12-in skillet. Remove and set aside."", ""Melt butter in skillet with bacon drippings over med-high heat. Add the mushrooms, 1 tsp salt and pepper and cook, stirring occasionally, until the mushrooms begin to give up some of their liquid, approximately 5 minutes. Add the garlic and nutmeg and continue to cook for another 1 to 2 minutes. Sprinkle the flour over the mixture and stir to combine. Cook for 1 min. Add the broth and simmer for 1 min. Decrease the heat to med-low and add the half-and-half. Cook until the mixture thickens, stirring occasionally, approx 6-8 minutes."", """", ""Remove from heat and stir in 14 of the French's onions and all of the green beans. Add bacon strips and stir well."", """", ""In a baking dish pour half of the green bean mixture. Place half of the Swiss cheese on top. Put 1/2 of the remaining French's onions on top of the Swiss cheese. Pour remaining green bean mixture into the baking dish and top with remaining French's onions. Top casserole with remaining Swiss cheese."", """", ""Cover and refrigerate casserole until you are ready to bake in the oven."", """", ""Preheat oven to 350 degrees. Cover with foil and bake for 30-45 minutes. Remove foil and continue cooking until the Swiss cheese turns slightly brown. Remove and serve immediately.""]",american,side,omnivorous
Chocolate Pizza,"[""Microwave chips and 14 ounces of the almond bark in bowl on High for 2 minutes; stir additionally until smooth."", ""Stir in marshmallows, cereal and peanuts."", ""Pour onto greased 12-inch pizza pan."", ""Top with cherries; sprinkle with coconut."", ""Microwave remaining 2 ounces bark and oil in glass measuring cup for 1 minute."", ""Continue until smooth."", ""Drizzle over coconut. Refrigerate until firm."", ""Store at room temperature.""]",italian,dessert,vegetarian
Mocha Creams with Raspberries,"[""Preheat oven to 350 degrees."", ""Heat cream to steaming in a small pan."", ""Stir in espresso powder, chocolate, and sugar."", ""Whisk in egg yolks."", ""Pour the mixture into pudding cups; this makes enough for 4 small or 2 large creams."", ""Place the cups in a larger pan."", ""Add hot water to the pan; the water should be about halfway up the pudding cups."", ""Cover the pan with tin foil."", ""Bake for 30 minutes."", ""Remove from oven and refrigerate until set."", ""Just before serving, top with raspberries and whipped cream.""]",french,dessert,omnivorous
Oktoberfest Brats Hoagie,"[""Grill or cook the bratwurst according to package directions."", ""Spread horseradish sauce on inside of hoagie roll."", ""Cut Bratwurst in half lengthwise and place on bun."", ""Arrange 1-ounce, turkey, 1-ounce ham, 3-slices tomato, 2-slices cheese, 2-strips bacon, 3-slices onion, 1-dill pickle and 1/2-cup lettuce onto bratwurst.""]",german,main,omnivorous
Sopa De Platano (Spicy Plantain And Corn Soup),"[""Melt the butter in a large saucepan or pot over medium heat. Add the onion and garlic, cooking until the onion is soft."", ""Add plantains, corn, and tomato. Cook for about five minutes."", ""Add all of the remaining ingredients, except for the nutmeg, and simmer until the plantain slices are tender. Add the nutmeg and serve hot.""]",latin american,main,vegetarian
Apple Cobbler,"[""Stir together pie filling, fried apples, 2 tablespoons flour, and cinnamon."", ""Spoon into a lightly greased 8-inch square baking dish."", ""Remove and discard crusts from bread (I freeze them for a later use)."", ""Cut each slice into 5 strips."", ""Using 5 strips at a time, laying them side by side in a single layer, cover entire top of apples in a checker board pattern."", ""Stir together remaining 2 tablespoons flour, sugar, butter, egg, and rind."", ""Drizzle over top of bread slices."", ""Bake at 350F for 35 to 45 minutes or until golden and bubbly."", ""For other fruit:."", ""Substitute 2 20 oz."", ""cans cherry pie filling for apple pie filling and"", ""1 15 oz."", ""can dark sweet cherries, drained, for the fried apples.""]",american,dessert,vegetarian
Watermelon Salad With Pomegranate Vinaigrette,"[""For the pomegranate vinaigrette:"", ""Place the citrus juice, pomegranate molasses, vinegar, honey, mustard, shallots, coriander, salt and pepper in a container. Emulsify, adding the oil slowly. Taste for seasoning."", ""For the watermelon salad:"", ""Combine the watermelon, cucumber, tomatoes, feta, basil and mint. Add the arugula and pine nuts. Plate and top with the currants and 3 ounces of the pomegranate vinaigrette.""]",american,starter,vegan
Biscuit Bread,"[""Combine all ingredients and mix well. Pour batter into a hot well-greased cast-iron skillet. Bake at 400\u00b0 for 18 to 20 minutes or until brown.""]",southern,side,vegetarian
White Beans With Onion Confit,"[""In a large saucepan, heat the olive oil until shimmering. Add the onions, garlic, rosemary and crushed red pepper and season with salt and pepper. Cover and cook over moderately high heat, stirring occasionally, until just softened, about 5 minutes."", ""Uncover and cook over moderately low heat, stirring occasionally, until the onions are very soft and lightly caramelized, about 15 minutes longer."", ""Stir in the beans, parsley and water and simmer until stewy, about 5 minutes."", ""Stir in the cheese and season with salt and pepper. Serve warm or at room temperature.""]",mediterranean,main,vegan
Pork And Pepperoni Pizza Burgers,"[""In a medium bowl, stir together ground pork, pepperoni, bread crumbs, pizza sauce and oregano. Shape mixture into 6 patties. Grill or broil burgers for 5 mintues per side, until an instant read thermometer reads 160 degrees F. Place burgers on buns; top each patty with cheese.""]",italian,main,omnivorous
Kentucky Jam Cake,"[""Cream butter and add brown sugar. Add beaten egg yolks.""]",american,dessert,omnivorous
"Onion, Ricotta & Sage Omelette","[""Preheat grill (broiler) to hot."", ""Whisk eggs in a bowl with salt & freshly ground pepper (to taste)."", ""Heat oil in in a 24-26cm (10-12in) pan."", ""Add onion & cook over medium heat, stirring occasionally, until soft & golden."", ""stir in sage & garlic."", ""Pour the eggs into the onion mix, crumble the ricotta over the top, then shake the pan to combine."", ""Top with sage & cook over med-low heat for 6 mins until almost set."", ""Place the pan under a hot grill (broiler) for 4-6 minsuntil golden."", ""slice & serve.""]",italian,main,vegetarian
Mock Oyster Casserole,"[""Cook eggplant and onion in unsalted water until tender."", ""Drain thoroughly."", ""Combine all ingredients; mix well."", ""Pour into buttered casserole and bake, uncovered, at 350\u00b0 for 30 minutes.""]",american,main,vegetarian
Pronto Taco Chili,"[""Over medium heat, cook beef, onion and garlic in a large saucepan until beef is browned."", ""Drain off any remaining fat."", ""Add beef broth, tomatoes, salsa, pasta, bell pepper, and chili powder."", ""Bring to a boil, stirring occasionally."", ""Reduce heat and simmer, covered, for about 10 minutes or until pasta is tender.""]",mexican,main,omnivorous
Cream of Leek Soup,"[""Wash leeks - make sure no sand between layers."", ""Dice leeks, reserve 1 cup of whites for later use."", ""Place green leeks and vegetables and put into large soup pot."", ""Add Water and bring to boil."", ""Add salt and pepper along with milk and boil for 30 minutes."", ""Strain soup reserving both liquid and vegetables."", ""Puree vegetables and return to soup pot."", ""Add reserved diced white leeks, butter and cream."", ""Bring to boil."", ""Watch pot stirring frequently."", ""Reduced heat and cook for 15 additional minutes."", ""Top with cheese if desired.""]",french,starter,vegetarian
Coconut Pie(Makes Own Crust)  ,"[""Combine all ingredients in order given and mix well."", ""Pour into a greased glass pie pan and bake at 350\u00b0 for 1 hour.""]",american,dessert,omnivorous
Simple Plum Pudding Recipe,"[""Mix, sift all dry ingredients, add in citron, currants, raisins, suet, mixed with little flour."", ""Add in beaten Large eggs, flavoring; beat thoroughly."", ""Pour into well-greased mold, steam 2-3 hrs."", ""Serve with sauce.""]",english,dessert,omnivorous
Graham Cracker Banana Cream Dessert,"[""Combine cracker crumbs and butter. Press into an ungreased 13-in. x 9-in. dish. In a large bowl, beat milk and pudding mix on low speed for 2 minutes. Pour over crust; top with bananas and pineapple. Spread with whipped topping (dish will be full). Sprinkle with pecans if desired."", ""Chill for at least 4 hours before cutting. Garnish with candy bar pieces and cherries if desired.""]",american,dessert,omnivorous
Asian Steak Strips (Crock Pot),"[""Combine the first 6 ingredients and blend well."", ""Take your steak strips and coat them well with the spice mix."", ""Put meat in the slow cooker and add the pepper strips, broth and bay leaves."", ""Cover and cook on low for 6-8 hours then remove the bay leaves and throw away."", ""Dissolve the cornstarch in water and stir into crock pot."", ""Turn temp to high and cover/cook on High until thickened."", ""Serve over rice or noodles.""]",asian,main,omnivorous
Coconut Curry Slo Cookr ,"[""Heat a teaspoon of coconut oil in a casserole pot or a large saucepan."", """", ""Add the lamb and stir it around on high heat until slightly browned. Add the onion, chilli and celery and cook for about a minute, until slightly softened. Bring the heat down to medium."", """", ""Add garlic, garam masala, turmeric, fennel seeds and ghee (or extra coconut oil if avoiding dairy). Stir through the lamb and cook for a minute to let the spices release their aromas."", """", ""Add coconut milk, tomato paste, water and sea salt. Stir and bring to boil. Then turn the heat down to simmer and cook for 1 hour, covered with a lid. Stir a couple of times."", """", ""After one hour, add the diced carrot and cook for a further 40 minutes, covered with a lid. Stir a few times."", """", ""Sprinkle some fresh coriander or parsley and drizzle a little lemon or lime juice before serving. Serve with your favorite vegetables or cauliflower rice, or real white rice if your heart so desires.""]",indian,main,omnivorous
Apple Tarts,"[""First we have to make the tarts crust"", ""Add cold butter and salt in flour."", ""Mix it well."", ""I knead it with my hand but if u hav a dough machine, that'll do your kneading."", ""Add water spoon by spoon and knead it to make a perfect dough."", ""Set it aside."", ""Its time to caramelise the apples."", ""Put thinly sliced apples in a sauce pan over medium heat."", ""Add water, sugar and cinnamon powder."", ""Leave it for 15 minutes till sugary syrup thickens."", ""Roll the dough and cut out circles from the dough with the help of a round glass."", ""(will look like mini chapatis)"", ""Grease muffin pans and put the chapatis in there filling them with caramelised apples."", ""Preheat oven to 180F and bake it till the crust is done."", ""I prefer to bake it few minutes before putting the caramelised apples.""]",french,dessert,vegetarian
Fish Soup Provencale(Bouride),"[""Mix mayonnaise and crushed garlic; cover and refrigerate."", ""Heat 1/4 cup of the butter in 12-inch skillet until melted. Toast 6 of the bread slices in skillet over medium heat until brown on both sides; rub one side of bread with half clove garlic. Remove from skillet; keep warm. Repeat with remaining butter, bread and garlic."", ""Cut fish filets into 1-inch pieces. Place fish in single layer in skillet. Add wine, onion and lemon slices, parsley, bay leaf, salt and just enough water to cover. Heat to boiling; reduce heat. Simmer uncovered until fish flakes easily with fork, about 6 minutes. Remove fish with slotted spoon; keep warm."", ""Strain fish broth. Pour 1 1/2 cups of the broth into 2-quart saucepan; gradually beat in mayonnaise mixture. Cook over low heat, stirring constantly, until slightly thickened."", ""Place 2 slices of the French bread upright in each soup bowl; spoon fish between slices. Pour soup over fish; sprinkle with paprika.""]",french,main,omnivorous
Blueberry Popovers,"[""Preheat oven to 375 degrees."", ""Divide the butter into the 6 cups of your popover pan. (If you don't own one, you can use a muffin tin, but you will need to use all 12 cups. Just divide the butter up evenly.) Place the pan in the oven for 3-5 minutes while you are making the batter."", ""In medium bowl, beat the eggs with the milk, vanilla, and sugar, then whisk in the flour. Pour the batter into the butter-filled cups, then evenly add a few blueberries to each cup. Return to the oven for 5 minutes, then reduce the temperature to 350 degrees and continue to bake for another 25 minutes. Popovers will be tall and gorgeous just out of the oven, but be warned-they shrink very quickly. It doesn't affect the taste, but if you are wanting pictures, foodies, snap 'em quick!"", ""Serve with a sprinkling of powdered sugar and the best maple syrup you can get your hands on.""]",american,dessert,omnivorous
Classic Lasagna,"[""Preheat oven to 350 degrees F (175 degrees C)."", ""Bring a large pot of lightly salted water to a boil. Add the lasagna noodles and olive oil; cook until al dente, 8 to 10 minutes; drain."", ""Cook the ground beef and sausage in a large pot over medium heat; drain. Stir in the mushrooms, garlic salt, oregano, thyme, basil, and tomato sauce. Season with salt and pepper; simmer 30 minutes."", ""Meanwhile, mix together the ricotta cheese, eggs, and Parmesan cheese in a bowl."", ""Ladle enough of the meat sauce into a 9x13 inch baking dish to cover the bottom in a thin layer. Form a layer atop the sauce with 3 of the lasagna noodles. Spread about 1/4 of the ricotta cheese mixture over the noodles. Sprinkle about 1/3 of the mozzarella cheese over the ricotta cheese mixture and then ladle about 1/3 of the meat sauce over the mozzarella cheese. Repeat layering twice more, topping with the remaining 1/4 pound of mozzarella cheese."", ""Bake in preheated oven 90 minutes. Allow to sit 10 to 15 minutes before serving.""]",italian,main,omnivorous
Fudge Pie,"[""Melt butter."", ""Mix all and pour into uncooked pie shell."", ""Bake at 400\u00b0 for 10 minutes and at 350\u00b0 for 20 to 25 minutes.""]",american,dessert,omnivorous
